ID,PRODUCT,SLOGAN,DESCRIPTION,CHARACTERISTICS,LISTA_URL
4885,TOK2,,"¿te ha pasado alguna vez que bajas a tomarte una cañita rapida sin grandes expectativas y acabas viviendo una de las mejores noches de tu vida? pues eso, mas o menos, es lo que sentiras con tok2. su tamaño reducido y su diseño discreto viene a recordarnos eso de ""menos es mas"", pero, ¡cuidado!, no subestimes a nuestra pequeña amiga, pues su potencia te sorprendera y con sus 10 programas de vibracion te garantizamos que tienes aseguradas muchas horas de juego y placer. ademas, si te gusta experimentar con tu sexualidad, probar cosas nuevas y unir sexo y diversion, esta bala es ideal para ti, ya que te ofrece un monton de posibilidades y, puesto que es increiblemente silenciosa y su mando a distancia no llamara la atencion de nadie, podras disfrutar de tu sexualidad mas alla de las puertas de tu casa. introducela bajo la ropa intima o en el interior de tu vagina, entregale el mando a quien tu quieras y sal a disfrutar de placenteras aventuras gracias a sus ocho metros de alcance. disfrutaras del placer mas absoluto con total discrecion.por todo esto seguramente tok2 sea uno de los productos mas vendidos de amantis, y de los que mas experiencias amanticas os hagan vivir. asi que si tu tambien quieres una sexualidad a prueba de balas, no te lo pienses mas y empieza a disfrutar con nuestra querida tok2 desde ya. ahora, ademas, te llevaras de regalo una bolsita de viaje para que tengas tu bala tok2 siempre cargada y lista para emprender la aventura... y es que no hay sexualidad que se resista a nuestra bala favorita.","100% Sumergible (ojo, el mando no)100% Recargable (cargador USB incluido)10 programas de vibración (3 niveles de intensidad + 7 programas)Fabricado en ABS (100% compatible y muy bueno con el cuerpo)Alcanza 8 metros de distanciaDimensiones bala: largo 7.5 cm, ancho 2 cmIncluye bolsita de viajeDisponible en color negro, púrpura y fucsiaNo apto para juego anal ",https://www.amantis.net/tok2-bala-vibradora-con-mando-ahora-mas-potente-y-recargable/
4998,SEXPIRAL,,"te animamos a que hagas de tus sesiones masturbatorias algo mas especial de lo normal. para ello existen masturbadores masculinos sin vibracion que aportan jugosidad y textura al tema y con los que podras pasar un buen ratito.sexpiral es un masturbador masculino hecho de silicona medica biocompatible de gran calidad. este tubo espiralado es elastico, gelatinoso, jugoso y al mismo tiempo con la rigidez necesaria para que nos perdure en el tiempo. tiene doble apertura, permitiendo que la eyaculacion sea libre y pueda salir por uno de sus extremos, lo que tambien es una ventaja a la hora de mantener las condiciones higienicas del juguete, facilitando mucho su limpieza.solo tocarlo con la mano te provocara un estimulo sensorial que despertara tu sentido del tacto. dentro de este cilindro residen pequeños relieves que masajean tu tronco del pene, despertando todas las terminaciones nerviosas que aqui se encuentran.con sexpiral sentiras un masaje de raiz, siguiendo una espiral que rodeara el cuerpo de tu pene, asi como buena parte del glande sin llegar a cubrirlo del todo. dejanos sugerirte que puedes acompañarlo de una felacion parcial con tu amante para intensificar la experiencia.sexpiral viene insertado en una capsula con funcion calor recargable, permitiendo que el masturbador se caliente sin necesidad de estar enchufado a un usb, gracias a su bateria de carga. simplemente presionando un boton, el palo vertical se calentara, transmitiendo este calor a nuestro masturbador.creenos, podras situarlo en cualquier esquina de tu hogar y nadie sospechara que es un masturbador, ya que la elegancia de su diseño hace que sea un elemento muy discreto y sofisticado.","Masturbador masculinoCon carcasaFunción calorMaterial: TPE + PP + ABSMedidas: 19 cm x 6,6 cm x 6,6 cmLibre de pfalatosSumergibleCómo se utiliza el masturbador masculino SEXPIRALPara utilizar este masturbador es necesario esperar a tener una erección y para su fácil inserción te sugerimos que utilices algún lubricante de agua como Desliz! Para activar la función calor, tendrás que colocarlo en su base y apretar el único botón que tiene, verás que se enciende una luz azul, a los pocos minutos ya estará listo para usar.No olvides lavar siempre tus juguetes antes y después de cada uso, con un limpiador específico para juguetes desinfectante y bactericida, como nuestro spray limpiador Limpín. Mantenén los juguetes separados entre sí, en un lugar seguro y seco. ",https://www.amantis.net/sexpiral-masturbador-masculino-con-efecto-calor/
5035,INTENSSE PRO,,"te damos la bienvenida al mundo de los succionadores (si es que aun no los conoces) con esta nueva propuesta de amantis, intensse pro, succion sonica, vibracion y dildo.  un 3 x1 al que le sera dificil no ponerle ojitos…la succion sonica estimula la parte interna del clitoris (si, el clitoris mide hacia adentro entre 6 y 8 cm, ¡algo asi como un iceberg!) por lo que los orgasmos son diferentes a los de la estimulacion por frotacion, que es lo que conociamos hasta ahora ¿entiendes ahora el por que de esta succi-revolucion?intensse pro te da mas: acciona un segundo boton para activar el modo vibracion, que se hara notarla vibracion la notaras en la otra cara de la boquilla de succion y a lo largo de todo el mando, convirtiendolo en un completo dildo con un solo toque.puedes  alternar succion y vibracion en un solo giro de muñeca. estimula tu clitoris, o vagina , o juega analmente. usalo con el mango hacia abajo para estimular tu propio perine o el de tu pareja de juegos mientras la onda sonica te acaricia, pues la longitud del juguete permite que las vibraciones sean disfrutadas por el otro a la vez. un juguete todo terreno, 3 en 1 y que vale para 2 a la vez.  parece una clase de mates e intensse pro ha sacado un bien logrado ¡sobresaliente!","Succión sónica , vibración y dildoRecargable, con cable para puerto USBSumergible IPX7Material: silicona evaluada clínicamente + ABSMedidas: 18.4 cm x 4.6 en el cabezal x 3.7  cabeza dildo9 modos succión + 9 patrones vibración ",https://www.amantis.net/intensse-pro-3x1-succion-dildo-vibracion/
5038,CLITKISS Succionador Sumergible Ideal (Ref,,"dejate besar por clitkiss tu succionador sumergible ideal. diseñado para ofrecer una estimulacion precisa y envolvente, este succionador combina la suavidad de la silicona con una potencia de succion imponente.vibracion versatil: con 10 modos de succion, el clitkiss te permite personalizar tu experiencia al maximo.diseño elegante: su color verde vibrante y su diseño ergonomico se adaptan perfectamente a la forma de tu cuerpo, brindando comodidad y facilidad de uso.facil de usar: alimentado por una bateria recargable por usb, el clitkiss es practico y respetuoso con el medio ambiente.resistente al agua: con una clasificacion ipx 5, este succionador es perfecto para usar en la ducha o en un baño relajante, asegurando diversion sin preocupaciones.instrucciones de uso:carga completa: antes del primer uso, carga completamente el succionador utilizando el cable usb incluido.seleccion de modo: presiona el boton de encendido y elige entre los 10 modos de vibracion disponibles para encontrar tu favorito.uso en agua: disfruta de una experiencia acuatica segura gracias a su resistencia al agua ipx 5.limpieza: limpia el succionador con agua tibia y jabon suave o utiliza limpin tu limpiador especifico para juguetes sexuales.disfruta de momentos de placer y bienestar con el clitkiss succionador sumergible ideal, tu compañero perfecto para explorar nuevas sensaciones a solas o en compañia.",,https://www.amantis.net/clitkiss-succionador-sumergible-ideal/
5082,STAY HARD 2P,,"stay hard es una familia de diferentes anillas que se comprometen con la salud sexual de tu pene, se casan contigo y te acompañan en tus rutinas sexuales aportando bienestar y mejora en tu rendimiento.stay hard doble perineal son dos anillas para la base del pene con un estimulador perineal en una sola pieza. al tener doble anilla en el pene reducimos el flujo de sangre del mismo y esto hace que el tamaño de tu pene aumente y las erecciones sean mas duraderas y potentes. el estimulador perineal cumplira la funcion de dar placer rozando una de tus zonas erogenas primarias y aumentando tu grado de excitacion. ojo es para estimulacion externa!  si buscas una anilla con plug incorporado tienes anettoel diseño de stay hard doble perineal permite colocar las dos anillas dejando que los testiculos queden en el medio de ambas, es decir que una ira en la base del pene por delante de los testiculos y la otra por detras. al quedar la segunda por detras el estimulador perineal se colocara en la zona que tenemos entre los testiculos y el ano, es decir, uno de los botones magicos de la anatomia masculina y el origen de las erecciones.estas anillas estan hechas de silicona de caucho y son completamente elasticas y flexibles. el tamaño indicado es el que tienen sin estirarlas pero si las estiramos pueden llegar a duplicar su diametro.como se utiliza las anillas para pene stay hard doble perinealte recomendamos que para colocar las anillas para pene utilices cualquiera de nuestros lubricantes a base de agua como desliz. antes de colocar las anillas, lubrica bien todo el tronco del pene y los testiculos para obtener mayor deslizamiento y facilitar la colocacion de las mismas.para poder colocar las anillas es recomendable que el ciclo de la ereccion se haya iniciado, no hace falta tener una ereccion completa pero si cierta excitacion. te recomendamos que no uses las anillas mas de 30 minutos y que si quieres volver a usarlas esperes al menos una hora entre sesion y sesion.","Medida anilla (1) : 4,5cm Medida anilla (1) : 4cm Color: negroSilicona de grado médico.Sin vibración  ",https://www.amantis.net/stay-hard-doble-anilla-estimulacion-perineal/
