,ID,PRODUCT,SLOGAN,DESCRIPTION,CHARACTERISTICS,LISTA_URL,amenities,anal,BDSM,femenino,masculino,juguetes,lenceria,muebles
183,183,Arnés Panty_Slip,todoterreno para dildos y packers en comodidad,"no podras dejar de tocar este arnes, y es que su mezcla de algodon y elastano hacen que simule a la perfeccion cualquiera de nuestras prendas interiores.con forma de braguita o slip, segun se mire, sus tiras se deslizan bajo las nalgas lo que ademas de sostenerlas y elevarlas, las señala como punto erotico visual high-level....para penetraciones simples, dobles y con bolsillo interno para acomodar una bala vibradora o para usarlo como packer. cualquiera de las opciones encajan a la perfeccion con este suave arnes todo terreno, y como tal, lavable en lavadora.se ofrece en 3 tallas: xs/s-m/l-l/xlsuave y comodo...facil de vestir, de colocar los dildos o packers y de lavar… que hoy en dia, ¡ eso es lo que cuenta! hazme la vida algo mas facil y te entregare mis mas profundos deseos…¿o no?","Tejido: algodón, Elastano, Poliéster y Nylon.color : negro3 tallas a elegir: XS/S M/L XL/XXL ",https://www.amantis.net/arnes-panty-slip-todo-terreno-comodidad-sujecion/,False,False,True,True,False,True,True,False
184,184,Pene hueco con arnés de Fetish Fantasy,,"¿alguna vez has querido sentirte mas seguro y reforzar el tamaño de tu pene y disfrutar del sexo con tu pareja hasta alcanzar juntos el orgasmo? ahora puedes tener el ancho y largo que siempre soñaste con el nuevo pene hueco con arnes de la serie fetish fantasy. su arnes elastico se ajusta facilmente a cualquier cintura, mientras que el dildo es suave de tacto pero rigido y eternamente erecto. es perfecto para hombres con disfuncion erectil, problemas de eyaculacion precoz o que simplemente buscan añadir algo de grosor y tamaño extra a su miembro. el dildo esta fabricado en un material libre de falatos y compatible con la mayoria de lubricantes de agua y silicona. limpiar despues de usar con limpin y agua tibia.",· Longitud total: 18.9 cm (17.8 cm insertables)· Diámetro: 4.3 cm· Longitud de la parte interior 10.4 cm· Diámetro de la parte interior: 4.3 cm· Tamaño cintura 132.1 cm· Incluye antifaz de regalo  ,https://www.amantis.net/pene-hueco-arnes-fetish-fantasy/,False,False,True,True,True,True,True,False
185,185,Arnés transpirable compatible con dildos,,"si sois de las parejas que ha llegado al grado de confianza, experiencia y pasion que demanda el uso de un arnes para dotarte de un dildo en tu pelvis y conocer la experiencia de estar armada y preparada para demostrarle como se puede mover esa cinturita. ademas es sencillo de usar, dispone de una anilla de sujecion semirrigida de 4cm de diametro que lo hace compatible con multitud de dildos que tengan base ancha, escoge los que querais probar de la seccion de dildos, introducelo por la anilla y preparaos para mambo del bueno. y es transpirable, por lo que la sesion podra durar hasta que el cuerpo aguante ya que el sudor no sera ningun inconveniente y por supuesto lo podras lavar despues de su uso y disfrute. te sugerimos que lo pruebes con el dildo doble penetrix especialmente diseñado para funcionar con este arnes transpirable, compatible y muy disfrutable. ademas si eres de cintura ancha o pequeña no importa... se ajusta perfectamente con sistema de velcros en cada extremo. a disfrutar!",,https://www.amantis.net/arnes-transpirable-compatible-dildos/,False,False,True,True,False,True,True,False
186,186,TOCCO,vibrador punto g,"explora el extasis con eleganciadescubre el placer que te ha estado esperando con tocco, un vibrador semi-flexible diseñado especificamente para la estimulacion profunda y precisa del punto g. su silueta refinada y su tacto de seda te invitan a un viaje de exploracion intima y satisfaccion sin precedentes."," Exquisitas:Versatilidad Vibrante: Con 10 patrones de vibración para elegir, TOCCO ofrece una sinfonía de placeres que resonarán al unísono con tus deseos más profundos.Dimensiones Diseñadas para el Deleite: Con una longitud de 19 cm y un diámetro de 2.6 a 2.8 cm, TOCCO es el compañero perfecto para quienes buscan una experiencia completa y envolvente.Recarga con Facilidad: La tecnología de recarga USB garantiza que tu TOCCO esté siempre listo para jugar, liberándote de las limitaciones de las pilas y ofreciéndote placer sin fin.Suavidad Suprema: Fabricado con silicona líquida de alta calidad, TOCCO promete una experiencia de tacto suave, proporcionando la delicadeza que tu piel merece.Flexibilidad Finesse: Suficientemente rígido para activar cualquier palanca, pero semi-flexible a la vez, se adapta a las curvas de tu cuerpo, asegurando que cada movimiento sea una caricia más en tu sinfonía sensorial.Punto G Prodigioso: La forma ergonómica de TOCCO está pensada para una estimulación intensa y focalizada del punto G, elevando tus momentos de placer a nuevas alturas.Invitación al Placer:TOCCO no es simplemente un vibrador; es una promesa de momentos robados, suspiros escondidos y una satisfacción que solo tú conoces. Su diseño elegante y discreto lo hace el secreto perfecto, listo para desvelar sus encantos a tu antojo.Con TOCCO, la experiencia es más que una escapada; es una odisea de placer. Permítete caer en la tentación de un juego previo extendido o en la intensidad de una sesión que promete llevar tus sensaciones al límite.Haz que cada encuentro con TOCCO sea tu obra maestra personal. ",https://www.amantis.net/tocco-vibrador-punto-g/,False,False,False,False,False,True,True,False
187,187,RABBIT CLASSIC,un clásico con doble estimulación,"presentamos el rabbit classic, tu nuevo compañero para una exploracion intensa y completa de placer dual. este juguete es la puerta de entrada al mundo de la doble estimulacion, punto g y clitoris, diseñado meticulosamente para ofrecerte experiencias inolvidables:doble estimulacion: experimenta la combinacion perfecta de estimulacion interna y externa, diseñada para acariciar y explorar todos tus puntos sensibles con precision.material de alta calidad: fabricado en tpr suave y seguro, este material libre de ftalatos y olores es amable con tu cuerpo, asegurando un placer sin preocupaciones.texturas y movimientos unicos: con puntos y estrias estrategicamente ubicados para maximizar tu placer al entrar y salir, ademas de una cabecita que gira explorando tu interior.variadas opciones de placer: ofrece 5 modos de rotacion en dos direcciones distintas, junto con 5 velocidades y ritmos para estimulacion clitoriana, permitiendote personalizar tu experiencia hasta alcanzar el climax deseado.dimensiones satisfactorias: con una longitud total de 21,5 cm y 12 cm insertables, y un diametro de 3,3 cm, esta diseñado para satisfacer sin abrumar, ideal para quienes se inician en el placer dual.resistente al agua: salplicable, perfecto para aventuras acuaticas en la ducha o la bañera, incrementando las posibilidades de juego y placer.energia eficiente: utiliza 4 pilas aaa (no incluidas), permitiendo un uso prolongado y facil reemplazo.cuidado y mantenimiento: asegura la durabilidad y la higiene del juguete usando solo lubricantes a base de agua y limpiandolo con productos especializados o agua tibia y jabon neutro antes y despues de cada uso.sumergete en una experiencia de doble placer con el rabbit classic, diseñado para llevarte a un viaje de descubrimiento y satisfaccion. preparate para explorar el pais de las maravillas del placer, guiada por este simpatico conejito que promete momentos de gozo intenso e inolvidable.","utiliza 4 pilas AAA (no incluidas) salpicable fabricado en TPR, sin ftalatos longitud: 21,5 cm, 12 insertables diámetro: 3,3cmNo olvides usar solo lubricante de base de agua ni limpiarlo antes y después de cada uso con Limpín o agua tibia con jabón neutro. ",https://www.amantis.net/rabbit-classic-doble-estimulacion/,False,False,False,True,False,False,True,False
188,188,VULVANIC APP: El Poder de la Pasión al Alcance de tu Smartphone,,"vulvanic app de amantis, es un vibrador controlado por aplicacion diseñado para integrarse perfectamente bajo tu lenceria favorita. imagina poder llevarlo a cenar y, con solo un toque en tu smartphone, darle a tu pareja el poder de convertir tu cuerpo en un volcan a punto de erupcion.su forma ergonomica y el tacto de suave silicona siguen ahi, pero ahora con la tecnologia añadida para una conexion mas intima e inmediata, adaptandose a tu cuerpo como un guante, abrazado por tu anatomia. sentiras un temblor de los pies a la cabeza cuando tu pareja decida, desde su movil, iniciar la vibracion, asi que preparate porque el terremoto no habra hecho mas que comenzar.va pasando el tiempo y ¿notas que el sushi se te empieza a atragantar? es hora de pedir la cuenta, porque el vulvanic app no se detiene hasta que todo el magma se haya liberado. y no te preocupes, sigue siendo 100% sumergible, perfecto incluso bajo el bañador.¿estas listo para esta erupcion de sensaciones? ¿ya has pensado donde lo disfrutaras la proxima vez?como usar tu vibrador vulvanic appeste vibrador controlado por aplicacion esta pensado para elevar la temperatura en cualquier entorno, ya sea una cena romantica o una salida nocturna. con su diseño ergonomico, vulvanic app se posiciona de manera optima entre las braguitas y la vulva, manteniendo su distintiva forma ondulada para un mar de sensaciones.antes de su uso, te recomendamos familiarizarte con la app en tu smartphone para manejarlo con confianza. una vez listo, colocalo en su lugar y pasa el control a quien desees para comenzar el juego. la distancia ya no es un limite para el placer compartido. con vulvanic app, lleva tu experiencia erotica a una dimension sin fronteras. no importa si tu pareja esta en la habitacion contigua o en un continente diferente, la app permite una conexion intima a cualquier distancia. asi, podras disfrutar de las vibraciones y juegos con tu pareja sexual estes donde estes, transformando cualquier punto del planeta en tu espacio personal para compartir placer. esta caracteristica global del vulvanic app te invita a cerrar la brecha entre el deseo y la satisfaccion, estrechando la intimidad y compenetracion a pesar de los kilometros de distancia.el nombre vulvanic app encapsula el poder de la naturaleza y la intensidad de las fuerzas volcanicas. nos inspiramos en la majestuosidad de la lava fluyendo lentamente por un volcan hasta alcanzar el mar.solo asegurate de tener un lugar acogedor para terminar la noche. eso es todo lo que podemos revelar por ahora.","Vibrador diseñado para vulvas, ahora controlado por una aplicación móvil.Material: Silicona (tacto aterciopelado) y ABS (acrilonitrilo butadieno estireno).Medidas: Vibrador 7,8cm x 4,5cm x 3,5cm.Vibración: 18 modos ajustables desde la app.Recargable (cable USB incluido). Tiempo de uso 1.5h aprox.Sumergible.Color: Fucsia con detalles plateados.Limpieza y conservación: Acompáñalo con tu lubricante a base de agua favorito y límpialo con agua tibia y jabón neutro, o con un producto específico como Limpín. Guarda el vibrador lejos de la luz solar directa y de manera individual, por ejemplo, en una de nuestras bolsas de satén. ",https://www.amantis.net/vulvanic-app-el-poder-de-la-pasion-al-alcance-de-tu-smartphone/,False,False,False,False,False,True,True,False
189,189,POSEIDON,vibrador punto g con triple estimulación,"llega el tridente que necesitas para pescar todos los orgasmos vengan de donde vengan. las posibilidades son muchas ya que poseidon va a tocar muchos de tus puntos erogenos haciendo dificil que se te escape maximizar el placer.poseidon es un vibrador punto g que tiene doble motor y triple estimulacion; del punto g, succion sonica para tu clitoris, y sistema de bolas thailandesas para la estimulacion anal. poseidon tiene dos motores independientes que podras activar por separado o de manera simultanea. uno de sus motores nos ofrece tres patrones de succion sonica; los succionadores sonicos consiguen que la estimulacion no solo se aplique al glande externo del clitoris. gracias a sus toques ritmicos, a traves de sus ondas longitudinales, tambien masajea sus raices internas, haciendo que los orgasmos sean mucho mas intensos.poseidon es un vibrador de un tamaño medio de dildo con una ligera curvatura para incidir en tu punto g y hacer pinza con la estimulacion clitoriana. en esta parte se encuentra otro potente motor que nos ofrece siete maneras de vibrar y que transmite su vibracion a la tercera parte del tridente: las bolas tailandesas anales. estas 6 bolas unidas, que van de menor a mayor tamaño, favorecen la dilatacion y se adaptan a la progresiva excitacion que necesitamos sentir para poder introducir algo en nuestro recto. las bolas tailandesas son una manera maravillosa de seguir el curso natural de nuestro cuerpo sin forzarlo a nada para lo que no este preparado.como se utiliza vibrador punto g poseidonposeidon es un juguete que estimula muchas partes de tus genitales a la vez, por lo que el cuerpo tiene que estar muy despierto y receptivo. ya que el placer que vamos a recibir es de alto grado, debemos estar muy excitadas para poder recibirlo y que no nos abrume demasiado.por ello, te sugerimos que empieces poco a poco, que uses el juguete por separado al principio, explorando cada parte del mismo y cada parte de tu cuerpo. dejate abrazar y acariciar por el antes de que estimule todas tus partes al mismo tiempo.te sugerimos que utilices algun lubricante a base de agua como bacanal, que es adecuado tanto para la penetracion vaginal como para la dilatacion anal. antes de introducir a poseidon en el interior de tu vulva, puedes probar a introducir la primera bolita en tu ano, para que luego todo vaya entrando al ritmo del cuerpo.recuerda que una vez tus genitales esten despiertos, tu clitoris es el ultimo en sensibilizarse y entrar en calor, es ahi cuando puedes activar la succion sonica y abandonarte al placer.no olvides limpiar antes y despues de usarlo con agua tibia y un jabon neutro, o un jabon bactericida como limpin. secalo bien antes de guardarlo y mantenlo alejado de otros juguetes, por ejemplo en una de nuestras bolsas de saten.","Hecho en silicona de grado médico y ABSRecargable por cable USB (incluido)2h. de carga, para 90 min. de uso continuado7 patrones de vibración vaginal3 patrones de succión sónicaMedidas:Dildo vaginal: 13 cm de largo; 3,5 cm de diámetro máximoDildo anal con bolas: 11 cm de largo; 2,5 cm de diámetro máximo, 1,5 cm de diámetro mínimoEstimulador de clítoris: 6,5 cm de largoSumergible ",https://www.amantis.net/poseidon-vibrador-punto-g-triple-estimulacion/,True,True,False,True,False,True,True,False
190,190,SATISFYER Pro 2,orgasmos múltiples e intensos con succión,"conocido ya en el mundo entero el hipergalardonado satisfyer pro 2 es en la actualidad el juguete mas famoso.pero ¿que es lo que tiene para estar en boca de todo el mundo? su succion por ondas sonicas sin contacto, es decir, estimula el clitoris en su totalidad (sus 12 centimetros ocultos en el interior de la vulva) ¡pero sin agobiarlo! solo hay que humedecer tu piel con un poco de lubricante a base de agua, buscar con su cabezal la cabeza del clitoris y apoyarlo.una vez ambas partes se hayan encontrado, no tendras que moverlo mas... aunque puedes jugar con sus 11 niveles de intensidad diferente que podras cambiar pulsando los botones + y - de este bonito juguete. ¿quieres mas experiencias? prueba su succion bajo el agua: orgasmos intensos bajo el mar, piscinas, bañera... ademas es silencioso, con una boquilla de silicona muy, muy facil de limpiar: coge tu limpin, pulverizalo, aclaralo, secalo (con especial cuidado en el interior de su boquilla) y ¡listo!ahora tambien disponible en el nuevo color violeta!","Material: Silicona y ABSSumergible IPX7Rescargable cable USB incluido. Tiempo de carga: 2,5h. Tiempo de uso: 30 minutos. ",https://www.amantis.net/satisfyer-pro-2-orgasmos-multiples-e-intensos-succion/,True,False,False,True,False,True,True,False
191,191,SATISFYER PRO2 GENERATION 3 la renovación del mito,,"ya esta en amantis la renovacion del bombazo de ventas satisfyer pro2!!despues de marcar un antes y un despues en los juguetes sexuales, vender millones de unidades en todo el mundo, y revolucionar los succionadores, satisfyer nos trae la version mejorada 3.0 de su exito mundial. el juguete que todo el mundo queria tener ahora añade:1- tecnologia liquid air, con dos capuchones intercambiables:  el capuchon adicional, con su fina y super suave membrana de silicona, crea intensas ondas que imitan la sensual oleada del agua pulsante. el pro 2 generation 3 inunda tu cuerpo con estas ondas de placer, creando una sensacion particularmente natural y permitiendo orgasmos nitidos como nunca antes habias experimentado. ¿prefieres provocar tu clitoris con la clasica tecnologia air pulse y completamente sin contacto? el pro 2 generation 3 viene con dos accesorios para que tengas las dos opciones. sumergete en 11 programas de ondas de presion, que puedes usar sin mas o combinar con 5 velocidades de vibracion y 7 patrones de vibracion2- cuerpo de silicona, mas resistente, agradable e higienico: el satisfyer pro 2 generation 3 tiene un diseño mate refinado. a diferencia de su predecesor, esta fabricado con silicona 100 % sin juntas, respetuosa con la piel y con tacto soft touch feel (super suave sobre la piel y especialmente higienico). su acabado resistente al agua (ipx7) permite que te lo lleves a la ducha o la bañera y tambien facilita su limpieza con agua tibia y jabon suave. despues de alcanzar climax alucinantes, puedes recargar facilmente las baterias integradas del vibrador con el cable de carga usb incluido.disponible en negro matetu clitoris se inundara de placer como nunca antes: ¡ya esta aqui el satisfyer pro 2 generacion 3! con la innovadora tecnologia liquid air, la ultima generacion de este clasico satisfyer.pincha aqui si prefieres la version con app","Succión por ondas Air Pulse y Liquid AirVibración para el clítorisMaterial: Silicona en cuerpo y boquillasVibración y succión independientesVibración: 12 modosSucción: 11 modosSilencioso, con un modo SusurroRecargable mediante cable USB y puertos magnéticosSumergible IPX7Color Negro mateLimpieza y conservación: Para limpiar tu SATISFYER PRO2 3.0 antes y después de cada uso solo debes aplicar un jabón neutro o, preferiblemente, un jabón bactericida como nuestro Limpín. Retíralo con agua y sécalo bien antes de guardarlo (para limpiar su boquilla puedes ayudarte de un bastoncillo). Utiliza únicamente lubricantes a base de agua. Mantén alejados unos juguetes de otros. ",https://www.amantis.net/satisfyer-pro2-generation-3-la-renovacion-del-mito/,False,False,False,True,False,True,True,False
192,192,SATISFYER PRO2 VIBRATION,un nuevo mundo de placer,"los estimuladores por ondas estan de moda y no es por casualidad. si ya te has dejado llevar por el maravilloso mundo de los succionadores de clitoris vas a alucinar con esta nueva version del superventas satisfyer pro2.lubrica con un poco de lubricante a base de agua tu clitoris y exponlo retirando suavemente tus labios vaginales. pulsa el boton de encendido/apagado durante unos segundos para sentir la clasica y eficaz estimulacion por ondas de la que todo el mundo habla.y ahora es cuando viene lo mas interesante: manten pulsado el boton independiente para dar rienda suelta a la vibracion, que podras manejar de manera independiente a la succion por ondas.¿echas en falta algo? por supuesto este nuevo modelo de la marca satisfyer es recargable y sumergible.¿lista para la revolucion de los orgasmos?","Estimulador por ondas y vibración para el clítorisMaterial: ABS y boquilla de siliconaVibración y succión independientesVibración: 10 modosSucción: 11 modosSilenciosoRecargable mediante cable USB y puertos magnéticosSumergible IPX7Limpieza y conservación:Para limpiar tu SATISFYER PRO2 VIBRATION antes y después de cada uso solo debes aplicar un jabón neutro o, preferiblemente, un jabón bactericida como nuestro Limpín. Retíralo con agua y sécalo bien antes de guardarlo (para limpiar su boquilla puedes ayudarte de un bastoncillo). Utiliza únicamente lubricantes a base de agua. Mantén alejados unos juguetes de otros. ",https://www.amantis.net/satisfyer-pro2-vibration-un-nuevo-mundo-placer/,True,False,False,True,False,True,True,False
193,193,ALIEN 2,dildo avatar alienígena,"no es ciencia ficcion, aunque te aseguramos sensaciones extraplanetarias, son los nuevos dildos 100% de silicona exclusivos de amantis, la nueva linea avatar.alien es un organismo perfecto, una maquina de matar cuya superioridad fisica solo puede competir con su potencia sexual. la oficial ripley y la tripulacion de la nave “nostromo” se habian enfrentado, en el pasado, a esa monstruosa criatura. y solo ripley sobrevivio a la masacre...su forma es agresiva, pero su tacto es calido y suave, su color es unico en cada pieza. pero su silueta y sus detalles te transportan a una experiencia unica sacada de una pelicula de ciencia ficcion. su impacto visual tremendo, estimula el juego a solas, pero genera sudores hasta la extenuacion en compañia.aplica unas gotas de tu lubricante favorito y acaricialo. su material, 100% silicona medica, es consistente pero suave, suficientemente rigido para abrirse profundos caminos pero maleable para adaptarse por donde pase. si nunca has probado la silicona te sorprendera y si ya la has gozado, sabes por que es el mejor material de tus dildos favoritos. su potente ventosa permiten adherir a alien a cualquier superficie lisa o utilizarlo en un arnes de anillas como el de amantis. y su calidad y forma lo hacen un excelente compañero de juegos e ilusiones por cualquier compuerta que quieras probar.ya esta aqui alien ¿podras con el?","Material 100% SiliconaLongitud total 18cm, (13cm de penetración)Diámetro de 3.5 a 4.5cmPeso: 330grFabricado en una sola piezaUsa solo lubricantes de base acuosaLimpiar antes y después de su usoGuárdalo alejado del contacto con otros plásticos. ",https://www.amantis.net/alien-2-dildo-avatar-alienigena/,True,False,True,True,False,True,True,False
194,194,AVATAR LEONARDO,dildo de proporciones perfectas,"tras presentaros al gran aplaudido avatar uasap y al super exitoso avatar doni, nuestra tecnica de silicona de doble capa, adquiere ahora nueva forma para crear a leonardo, el nuevo avatar de diseño y tamaño, simplemente p-e-r-f-e-c-t-o.asi como lo lees, como si hubiese sido moldeado y esculpido por el mismisimo leonardo da vinci, como el mas bello de los penes. sus equilibrados 19cm de largo total y sus 4cm de ancho definen la armonia hecha dildo. con su toque justo de estrias, testiculos en su punto y un glande de notable pero refinada presencia, hacen de este pene de proporciones aureas, el mas deseado del imperio.ademas, tal y como viene siendo en toda su familia avatar, leonardo, esta creado en una unica pieza sin juntas ni rebordes, increiblemente suave al tacto y con un milimetrado equilibrio entre flexibilidad y firmeza.por supuesto, semejante belleza viene rematada por una ventosa de sujecion (para incluirla en tu arnes favorito) y fijacion (para adherirla en cualquier superficie lisa de tu entorno, incluida la pared del baño ya que es 100% sumergible).en tu intimidad, llamale leo, llamale nardo… pero jamas tendras dildo mas imperioso. con el, sin duda, descubriras el secreto de la sonrisa de la mona lisa.","Dildo realistaMaterial: 100% Silicona de grado médico. Doble densidadMedidas: 19cm de largo total (14cm insertables) y 4cm de diámetroCompletamente sumergibleVentosa de sujeciónCompatible con arnés universalColor: caucásico o negroLimpieza y conservación: Recomendamos el uso de tu lubricante con base de agua favorito para cualquier tipo de juego sexual y obtener así, la mejor experiencia. No olvides lavar siempre tus juguetes después de cada uso, con un limpiador específico, como nuestro spray limpiador Limpín. Te recomendamos mantener los juguetes separados entre sí, en un lugar seguro y seco. Puedes utilizar nuestras bolsas de terciopelo en diferentes tamaños. ",https://www.amantis.net/avatar-leonardo-dildo-proporciones-perfectas/,False,False,True,True,False,True,True,False
