,ID,PRODUCT,SLOGAN,DESCRIPTION,CHARACTERISTICS,LISTA_URL,amenities,anal,BDSM,femenino,masculino,juguetes,lenceria,muebles
53,53,DUAL LIPPS,masturbador masculino doble,"a muchos nos surge la duda a lo hora de decidir entre un masturbador con forma de vagina o uno con forma de boca… pero, ¿por que no tener ambas en un solo juguete? este increible masturbador tiene dos canales de entrada, uno con forma de boca y, en su parte opuesta, otro con forma de vagina. es tan dificil resistirse a los carnosos labios de su boca como a los tersos y delicados labios de su vagina. tu unica tarea es decidir que te apetece mas en cada momento y que combinaciones hacer. las estrias internas de cada parte te transmitiran la sensacion de estar metiendola en una vagina o una boca de verdad. pero, lo mejor es que en el medio del juguete las estrias cambian, de modo que podras probar lo que se siente jugando con una boca y una vagina ¡a la vez!. ademas, esta hecha de ciberpiel para que disfrutes de la sensacion mas realista que existe. empuja, ¡por un lado, por el otro, o por los dos…! ¡hasta que ya no puedas resistirte a dual lippa!.como se utiliza el masturbador dual lippa:aplica un poco de lubricante a base de agua en tu pene, en el juguete o en ambos e introduce tu miembro por su canal de entrada. puedes cogerlo con una mano o con las dos y tambien jugar solo o en compañia. si dejas que sea otra persona la que dirija la situacion, podras masturbarte en modo “manos libres” mientras la otra persona se excita de ver como te da placer a traves del juguete.consejos: no utilices aceite mineral, lubricantes a base de aceite o lubricantes a base de silicona. despues de su uso, lava el juguete con agua tibia, limpin y dejalo secar al aire.","Material: TPE (ciberpiel)Textura: muy blando, elástico y suaveMedidas: 20 cm de profundidad × 7,5 cm de diámetroConsejos: no utilices aceite mineral, lubricantes a base de aceite o lubricantes a base de silicona. Después de su uso, lávalo con agua tibia, Limpín y déjalo secar al aire. ",https://www.amantis.net/dual-lippa-masturbador-masculino-doble/,True,False,False,False,False,True,True,False
54,54,TOTEM,anilla para pene,"si te contamos que el placer carnal se puede potenciar con tecnicas naturales y ancestrales, ¿te dan ganas de probarlas? presionar la base del pene, de los testiculos o de todo el conjunto son tecnicas usadas en la historia para jugar con la potencia de ereccion, la sensibilidad del pene y los tiempos de eyaculacion. las anillas, mas conocidas como cock rings en ingles, son usadas para esta suerte de juegos placenteros entre las sabanas. hay muchas formas de usar tu totem, pero te proponemos que empieces por estas:si pones tu anilla en la base del pene (por delante de los testiculos): estas anillas ejercen presion en la base del pene consiguiendo un engrosamiento del mismo y una ereccion mas duradera. la sensibilidad en este varia y en los juegos de pareja ambas partes lograran sacar provecho de este nuevo juego carnal. si la pones en la raiz del pene (por detras de los testiculos): ademas de aportar endurecimiento, grosor y durabilidad de la ereccion (como la anterior), esta anilla ejerce tambien una presion en los testiculos, lo que erotiza la vista al mismo tiempo que sensibiliza la zona y ayuda a controlar la eyaculacion por la presion de la anilla sobre el conducto deferente.","​​​​Material: 100% silicona.Suaves y elásticas.Color: negro.Medidas diámetro interior: 3.5 cm (tamaño 1); 4 cm (tamaño 2); 4.2 cm (tamaño 3); 4.6 cm (tamaño 4); 5 cm (tamaño 5).Cómo se utiliza la anilla para pene TOTEMPara utilizar esta anilla es recomendable esperar a tener una erección, y para su fácil colocación es recomendable que utilices algún lubricante de agua como Desliz!Es importante que la anilla se adecue al tamaño de tu pene para que haga su función correctamente y no apriete más de lo debido.¿Cómo saber si es un tamaño adecuado para mí?Calcula el diámetro de tu pene o del conjunto de tu pene y testículos.Réstale 3 mm para que la anilla quede prieta. La anilla debe presionar pero, ¡no apretarte hasta el desmayo! Asegúrate de que una vez colocada te cabe un dedo estirando la goma.Colócala con el pene semierecto y con lubricante.Úsala un máximo de 20-25 minutos y no te quedes dormido con ella. ",https://www.amantis.net/totem-anilla-para-pene/,False,False,False,False,False,False,True,False
55,55,DINKY 10,el anillo vibrador más vendido de amantis,"vuelve a amantis un clasico de nuestros cajones, el famoso dinky banger. y como no podria ser de otra forma, lo hemos mejorado, aportando una bala con 10 patrones de vibracion, aumentando sus revoluciones un 15% y bajando el precio. ¿se puede pedir mas?corria el año 2005, cuando aparecio esta original anilla vibradora diseñada en inglaterra y pensada, para que aquellas parejitas que querian disfrutar de orgasmos simultaneos y se quedaban con las ganas pudiesen, de una vez por todas, hacerlo realidad. ¡y vaya que si lo consiguieron! miles de dinkys, fueron probados, disfrutados, mojados o calentados en el roce de los cuerpos de sus apasionados amantes una y otra vez. años despues y a pesar de su gran exito, la fabrica cerro, y tuvimos que dar la mala noticia a muchos clientes que volvian a amantis a buscar un nuevo dinky (lo habian perdido, habian cambiado de pareja o simplemente habia muerto tras un servicio intachable).por eso hoy es un gran dia, tanto para los miles de parejas que lo han disfrutado, como para todas aquellas que quieran conocer si merece estar entre los imprescindibles de su mesilla.¿como usar dinky 10?simplemente introduce la balita vibradora en la funda flexible y anilla tu pene con dinky, despues puedes colocar el vibrador hacia arriba para estimular exclusivamente la anatomia femenina o hacia abajo, recibiendo las caricias tanto ella y su vulva, como el y sus testiculos. tambien puedes usar tu dinky 10 como un simple vibrador sin anillar, y al ser sumergible, podras disfrutar de dinky tambien en entornos acuaticos.¿por que tiene esa forma?su diseño es sencillo pero muy funcional, lleno de pequeños relieves y puntitos de caricias para estimular bien alli donde necesites. pocas anillas vibradoras tienen una forma de estimulacion vertical, facilitando que quede en contacto directo con tu clitoris y labios mayores.¿por que debo usar dinky 10?te ayuda a compenetrarte con tu pareja, a estimular alli donde un pene no puede, activando las zonas de placer femenino y facilitando encadenar orgasmos simultaneos. no se nos ocurre ninguna razon por la que no usarlo, la verdad.¿ready? ¡5.000 parejas no podian estar equivocadas!", Usa 3 Pilas LR44 (incluidas) Fabricado en suave plástico TPR (bueno con tu cuerpo) No contiene Ftalatos (ni olores plásticos) 10 Patrones de vibración 100% Sumergible Limpialo bien antes y después de cada uso Desmontable Disponible en color azul o púrpura ,https://www.amantis.net/dinky-10-el-anillo-vibrador-mas-vendido-amantis/,False,False,False,True,False,True,True,False
56,56,MR DUPLO,doble anillo para tu pene,"dale a tu miembro vigor, lozania y super poder con mr duplo, la anilla doble de amantis. veras y sentiras tu miembro mas potente, erecto y lustroso gracias a esta nueva anilla de amantis. aprovecha la oferta.mr duplo no es una anilla cualquiera, tiene un nuevo diseño hecho en silicona medica de doble densidad, que traducido significa que es supersuave, comoda, blandita y facil de colocar.coloca a mr duplo con su piquito mirando hacia abajo, lubrica bien tu mastil del placer y desliza la primera de las anillas por tu miembro antes de tener una ereccion completa para ayudarte a conseguirla. cuando estes listo desliza la segunda de sus anillas por tus testiculos para retrasar el momento de la eyaculacion.¿listo para dejar sin palabras a tu amante?",Anilla doble fácil de colocarMaterial: silicona de grado médico de doble densidadMedidas: largo: 7 cm; ancho máximo 5 cm; diámetro anilla pene: 2.5 cm (elástica); diámetro anilla testículos: 2.5 cm (elástica)Color: azul o negroCómo se utiliza el anillo doble para pene MR DUPLOPara utilizar esta anilla es recomendable esperar a tener una erección y para su fácil inserción es recomendable que utilices algún lubricante de agua como Desliz!Es importante que la anilla se adecue al tamaño de tu pene para que haga su función correctamente y no apriete más de lo debido.¿Cómo saber si es un tamaño adecuado para mí?Calcula el diámetro de tu pene o del conjunto de tu pene y testículos.Réstale 3 mm para que la anilla quede prieta. La anilla debe presionar pero ¡no apretarte hasta el desmayo! Asegura que una vez colocada te cabe un dedo estirando la goma.Colócala con el pene semierecto y lubricanteÚsala máximo 20-25 minutos y no te quedes dormido con ella. ,https://www.amantis.net/mr-duplo-doble-anillo-tu-pene/,False,False,False,False,False,False,True,False
57,57,SILVER,funda avanzada con riendas para pene,"silver es una funda para pene que redefine la experiencia sexual, combinando un diseño realista con funcionalidades avanzadas. esta funda no solo se enfoca en aumentar el tamaño del pene, sino que tambien aporta un nivel superior de estimulacion y comodidad.diseño y funcionalidad:realismo y comodidad: diseñada para replicar de manera natural las formas del pene, silver ofrece un aspecto realista y un ajuste comodo.estimulacion añadida: los relieves en la funda estan diseñados para proporcionar un masaje y estimulacion adicionales durante la penetracion, mejorando el placer para ambas partes.deslizamiento mejorado: el material suave y flexible de silver facilita un deslizamiento jugoso y resbaladizo, enriqueciendo la experiencia sexual tanto interna como externamente.flexibilidad y adaptabilidad:material flexible: fabricada con tpe de alta calidad y libre de ftalatos, la funda silver se adapta a cualquier tamaño de pene, ofreciendo una experiencia personalizada y comoda.texturas suaves: las texturas estimulantes de la funda son delicadas al tacto, proporcionando una estimulacion suave y placentera.soporte en diversas situaciones:disfuncion erectil: silver es un aliado valioso para aquellos que enfrentan problemas de ereccion, ayudando a mantener una rigidez funcional.relaciones prolongadas: ideal para mantener la experiencia sexual placentera y continua en encuentros prolongados."," de la Funda para Pene SILVER:Material: TPE suave y flexible, libre de ftalatos.Medidas: 15,8 cm de largo x 4 cm de diámetro.Peso: 52 g.Color: Transparente, para una apariencia discreta.Resistencia al agua: Totalmente sumergible.Instrucciones de Uso:Usar sobre un pene erecto, aplicando lubricante a base de agua para una inserción fácil.La funda puede mantenerse puesta incluso si se pierde la erección.No exceder los 20-30 minutos de uso y evitar dormir con ella puesta.Cuidado y Mantenimiento:Limpieza recomendada con jabón neutro o bactericida antes y después de cada uso.Almacenar individualmente, lejos de la luz solar directa.SILVER no es solo una funda para pene; es una innovación que promete transformar tus momentos íntimos en experiencias más enriquecedoras, cómodas y satisfactorias. ",https://www.amantis.net/silver-funda-avanzada-con-riendas-para-pene/,False,False,False,False,False,False,True,False
58,58,Arnés BASIC CORSÉ,"cómodo y firme, especial iniciación","adelante, mujer brava y con iniciativa… ¡ponte a repartir placer a diestro y siniestro!asi es, el arnes sexual basic corse de amantis, con acabados de imitacion piel, te abrira todo un mundo nuevo de posibilidades. porque segun el acompañante o dildo elegido para la ocasion, abrira tanto puertas vaginales como anales, adentrando todo tu cuerpo en ellas.este arnes ha llegado a amantis para las parejas que quieren iniciarse en los placeres con arnes sexual, amantes de los acabados mas lustrosos, con un toque extra de sofisticacion y, al mismo tiempo, comodidad. se adaptara perfectamente a los contornos de tu cuerpo, ya que tiene un acabado levemente acolchado y muy suave por la parte interior, lo que permitira que puedas moverte libremente y de forma flexible sin ninguna molestia.las tiras, muy sencillas de ajustar, han sido diseñadas siguiendo la linea de los gluteos, asi el resultado final es el de una braguita ajustable con un cinturon de imitacion piel. dejando toda tu area vaginal y anal libre y dispuesta a recibir las gracias que tu mereces.cuenta con una anilla metalica (la cual puede extraerse para lavar el arnes o para intercambiarla por otras), abarcando la gran mayoria de tamaños de dildos, siempre que cuenten con base o ventosa.¿te hemos dicho que tienes un sin fin de compañeros de viaje, verdad? por ejemplo nuestra coleccion de dildos avatar o nuestros glups! son perfectos para combinar con tu nuevo arnes sexual.da placer extra con todo tu ser. utiliza el arnes cual extension corporal, elige elemento que lo complemente y decide tu que ritmo, postura y contoneo vas a ofrecer.recomendamos el uso de tu lubricante con base de agua favorito, como desliz!agua para mejorar tu experiencia.",Composición: 100% Poliéster y algodónTalla: ÚnicaColor: NegroLimpieza y conservación: Lavar con agua fría y utilizando productos de limpieza suaves o específicosDildo no incluido ,https://www.amantis.net/arnes-basic-corse-comodo-firme-especial-iniciacion/,True,True,True,True,False,True,True,False
59,59,ALASKA,arnés para que te monten la pierna,"¿has pensado alguna vez en lo excitante que puede ser que te monten la pierna o montarla tu? en amantis exploramos todas las fantasias de perreo maximo, incluso aquellas que no sabias ni que tenias. te presentamos nuestro maravilloso arnes de pierna con la intencion de sorprenderte con sus multiples usos. el arnes alaska es ajustable con doble cierre de velcro, es blandito con costuras suaves y de neopreno. este arnes no contiene anilla pero el agujero tiene un tamaño estandar que la hace compatible con la gran mayoria de tamaños de dildos, siempre que cuenten con base o ventosa. el arnes alaska te abrira mundos y posturas en las que encontraras nuevas maneras de estimular a tu pareja y dejar libres otras partes del cuerpo mientras alguien se monta tu pierna. es para todo tipo de parejas, en donde da igual quien monte, porque respectivos genitales quedaran libres y expuestos a ser estimulados de otras maneras, con manos, rodillas o cualquier juguete sexual que querais introducir. otra de las maravillosas ventajas del arnes alaska es que puede servir como asistente postural, es decir, que lo puedes atar a un cojin o almohada y gozar de una masturbacion activa en la que tendras que moverte bien fuerte.  ademas es un gran amigo de las personas con disfuncion erectil, pudiendo ser un camino muy interesante hacia una posible ereccion, ¡se pueden dar movimientos y roces muy provocadores! y, por si fuera poco, el arnes puede convertirse en el mejor amigo de personas con diversidad funcional o movilidad reducida. ¿ya sabes con que tipo de dildos puedes empezar a ladrar? conoce nuestra coleccion de dildos avatar o nuestros glups! o lizo.","Composición: 100% Poliéster y algodón.Talla: ÚnicaContorno máximo de muslo 55-60 cmDiámetro máximo de dildo 3,6 cmColor: NegroLimpieza y conservación: Lavar con agua fría y utilizando productos de limpieza suaves o específicos ",https://www.amantis.net/alaska-arnes-sexual-pierna/,False,False,True,True,False,True,True,False
60,60,VELORIA,revolución en placer compartido,"presentamos veloria, la ultima innovacion de amantis que redefine el placer compartido, elevando la experiencia intima de tandem a nuevas alturas de audacia y satisfaccion. veloria no es solo un juguete sexual, es una aventura atrevida para amantes que desean explorar cada faceta del placer con confianza y sin reservas. diseñado meticulosamente para complementar el iconico tandem, veloria introduce una dimension extra con un delicado dildo anal, garantizando una experiencia aun mas completa y envolvente.diseño revolucionario para una experiencia integralmaterial premium con un plus: manteniendo la calidad suprema de tandem, veloria esta fabricado en silicona higienica aterciopelada de grado medico, ofreciendo seguridad y confort. la adicion de un pequeño dildo anal proporciona un placer adicional, garantizando una experiencia completa para ambos.doble estimulacion con innovacion anal: integrando todas las caracteristicas amadas de tandem, desde su diseño ergonomico hasta la estimulacion clitoriana y del punto-g, veloria va un paso mas alla con la inclusion de un estimulador anal. este nuevo componente esta diseñado para una insercion comoda y un placer adicional, asegurando que cada sensacion se amplifique.tecnologia avanzada para el triple de placer: al igual que tandem, veloria incorpora un espacio para una bala vibradora recargable (incluida) con 10 patrones de vibracion distintos. este sistema no solo potencia el placer vaginal y clitoriano sino que tambien envia ondas de placer a traves del estimulador anal, creando una experiencia tridimensional."," Exclusivas de VELORIA:Estimulación Anal Discreta y Efectiva: El dildo anal, perfectamente contorneado para el placer sin esfuerzo, ofrece una nueva dimensión de satisfacción, permitiendo a las parejas explorar los límites del placer con total seguridad.Versatilidad sin Precedentes: Ideal para parejas de todas las orientaciones, VELORIA promete enriquecer las experiencias íntimas con su longitud operativa y su capacidad para adaptarse a diferentes dinámicas de placer.Placer Compartido, Experiencia Amplificada: VELORIA es más que una adición a la colección de juguetes sexuales de una pareja; es una puerta hacia un universo de exploración mutua y satisfacción sin límites.VELORIA: Una Invitación al Placer Sin BarrerasCon VELORIA, amantis invita a las parejas a dejar de lado las inhibiciones y a sumergirse en un mundo donde el placer no conoce límites. Es una herramienta para descubrir nuevas formas de conexión y para intensificar cada encuentro íntimo con una promesa de placer inigualable.¿Listos para explorar el placer en todas sus dimensiones? VELORIA os lleva más allá. Medidas: Largo total 21 cmDildo Principal: 18 cm insertables, anchura máxima 3,5 cmDildo Intermedio: 10 cm insertables, anchura máxima 4 cmEstimulador final: 8 cm de largo, anchura máxima 2 cm  ",https://www.amantis.net/veloria-revolucion-en-placer-compartido/,False,True,False,True,False,True,True,False
61,61,MASTINA,"un arnés clásico, cómodo y sencillo","¿te han entrado ganas de ver que se siente al ser una hembra que monte? el arnes mastina es un arnes muy sencillo para empezar a transitar nuevos caminos inexplorados hasta ahora. es perfecto para iniciacion por su comodo funcionamiento, gracias a la discrecion de su diseño, te sentiras comoda y segura con el puesto. el arnes mastina tiene una base hecha de neopreno que cubrira y protegera tu zona genital evitando roces no deseados. toda la base tiene un efecto acolchado que permitira que puedas moverte libremente y de forma flexible sin ninguna molestia. su base esta abierta lo cual lo hace compatible con dildos dobles, aquellos en los que tu introduces un extremo en la vagina y el otro queda por fuera. las tiras, muy sencillas de ajustar, han sido diseñadas con una generosa longitud para que podamos adaptarlas a todo tipo de dimensiones corporales. cuenta con una anilla metalica que tiene un tamaño estandar haciendola compatible con la gran mayoria de tamaños de dildos, siempre que cuenten con base o ventosa. esta anilla metalica es intercambiable, es decir, que gracias a los botones la puedes quitar y cambiar por otra de otro material o tamaño que se ajuste al dildo que apetezca disfrutar en cada momento. ¿ya sabes con que tipo de dildos puedes empezar a ladrar? conoce nuestra coleccion de dildos realisticos avatar o nuestros glups! o lizo.",Composición: 100% Poliéster y neoprenoTalla: ÚnicaColor: Negro Limpieza y conservación: Lavar con agua fría y utilizando productos de limpieza suaves o específicosDildo no incluido ,https://www.amantis.net/mastina-arnes-clasico-comodo/,False,False,True,True,False,True,True,False
62,62,MASSAJI,potente masajeador japonés sumergible de silicona,"¿quieres una velada perfecta tras un largo dia en el trabajo? pues disfruta dandote un buen masaje relajante, desde los pies hasta la espalda, y cuando todo tu cuerpo este liberado de tensiones y relajado, regalale un orgasmo de pelicula.enciende una vela, pon algo de musica de fondo y disfruta de un suave masaje… masajea el cuerpo de tu amante o el tuyo, incide en las zonas que a lo largo del dia han acumulado mas tension, y aprovechate de sus 9 modos de vibracion diferentes para dejar atras toda esa tension. poco a poco tu cuerpo se relaja, se destensa y se vuelve mas receptivo a los estimulos….ahora, ha llegado el momento de pasar a un nivel superior de disfrute: aplicate un poco de desliz! lubricante a base de agua en tus zonas mas erogenas y dejate llevar por las sensaciones mas intensas que puedas imaginar. massaji dispone de un cabezal pensado para masajear puntos orgasmicos como los labios exteriores de la vulva, los pezones o los testiculos, y un mando con estrias que haran vibrar cualquier parte de tu cuerpo. asi que mima y excita tu cuerpo tanto como se merece hasta hacerlo estallar de placer.a estas alturas seguro que ya fantaseas con tener a massaji recorriendo tu cuerpo, y es que massaji esta lleno de cualidades, unas ya las sabes, otras como que es uno de los juguetes mas silenciosos que encontraras, o que puede ser usado bajo el agua te lo acabamos de decir, pero es que massaji esta lleno de virtudes que solo descubriras cuando lo sientas contra ti, ¿te animas?",Masajeador Japonés Massaji Material: Silicona médica y ABS Sumergible IPX7 Recargable USB Medidas: 20cm X 4cm  Vibración: 9 modos Lavar antes y después de cada uso con limpiador y agua caliente. ,https://www.amantis.net/massaji-potente-masajeador-japones-sumergible-silicona/,True,False,False,False,False,True,True,False
63,63,VINTAGE,vibrador clásico metalizado,"¡que tendran los ochenta que nos encantan! los ochenta fueron la decada de las hombreras, la laca y los tules, fue la epoca de sex symbols como mickey rourke y sharon stone. la efervescencia de una moda que podria definirse en dos palabras: sexy y brillante. asi que nuestro homenaje a esta epoca no podria ser de otra manera. vintage es sexy y brillante, porque es la bala vibradora mas ochentera y añorada de amantis. es cierto que todas las balas son juguetes enormemente versatiles, pero a veces, su pequeño tamaño puede hacerte echar de menos una longitud o grosor mayor. pues eso justo es lo que te ofrece vintage, con su tamaño considerablemente mayor, tanto en grosor como en longitud, hara que no tengas que echar nada de menos. sus brillos y reflejos haran la fantasia del momento, empieza a imaginar como se veran las formas reflejadas o como quedaran sus paredes tras una sesion de placer vintage.vintage te ofrece una vibracion progresiva unica, mas cosquilleante y sutil que la de otros vibradores ya que su potencia viene dada por una simple pila aa. regula su potencia a traves de una ruedita que tiene en su base desde muy suave hasta su maxima potencia y dejate arrastrar por el encanto de los ochenta. las posibilidades de juego de vintage son infinitas: usala durante la masturbacion, para estimular cualquier parte de tu cuerpo en cualquier momento, para darle una vibracion extra durante el sexo oral, penetracion, etc.  y es que las balas vibradoras no son solo juguetes genitales, perdon, geniales.la vibracion que emite es diferente a la de los vibradores y juguetes que tenemos de silicona medica, es mas cosquilleante y sutil. no te pierdas recorrer todo tu cuerpo y el de tus amantes con ella, sera algo que estremecera cualquier centimetro de tu piel y activara tu circuito de excitacion.¿te ponen los 80? prueba vintage.","Bala metalizada14 x 2´7cm Vibración regulable con rueditaColores: dorado y plateadoUsa 1 pila AA Fabricado en ABS + Metal Sin FtalatosCómo se utiliza la bala vibradora VINTAGEEsta bala no está pensada para introducirla en el interior del cuerpo, ya que no tiene tope de seguridad ni ningún sistema de extracción, por lo que te recomendamos que la uses de manera externa.Es recomendable siempre usar uno de nuestros lubricantes a base de agua como Desliz! para favorecer la penetración y aumentar el placer.No olvides limpiar antes y después de usarlo con agua tibia y un jabón neutro, o un jabón bactericida como Limpín. Sécalo bien antes de guardarlo y mantenlo alejado de otros juguetes, por ejemplo en una de nuestras bolsas de satén. ",https://www.amantis.net/vintage-vibrador-clasico-metalizado/,False,False,False,False,False,True,True,False
