,ID,PRODUCT,SLOGAN,DESCRIPTION,CHARACTERISTICS,LISTA_URL,amenities,anal,BDSM,femenino,masculino,juguetes,lenceria,muebles
116,116,ONIX,"masajeador de próstata, perineo y testículos con anilla","¿quieres explosionar estimulando todas tus zonas erogenas de manera simultanea? onix es un masajeador de prostata, perineo y testiculos con anilla incorporada. ¿todo a la vez? si, todo a la vez. esta pensado para estimular todos los puntos erogenos de los genitales masculinos y elevarte a cotas maximas de placer si lo compaginas tambien con relaciones sexuales.onix se compone de dos partes unidas entre si:por un lado, encontramos el vibrador prostatico con un diseño ergonomico que se adaptara perfectamente a nuestra anatomia. al final del mismo apreciamos una bolita saliente que acariciara nuestra prostata. en la union, el juguete mantiene su rigidez para que nuestro perineo tambien reciba placer.por el otro, encontramos un masturbador masculino que envolvera los testiculos y los estimulara con su vibracion, ademas de tener una anilla que ira situada en la base del pene para ayudar a retrasar la eyaculacion.este juguete nos ofrece 9 patrones de vibracion que recorreran los mayores puntos de placer de nuestros genitales. ademas, es salpicable y muy silencioso.","Medidas: 15,8 cm x 12,8 cm x 5,3 cmMaterial: silicona + ABS9 modos de vibraciónTipo de carga: mediante cable USB (incluido)Sumergible IPX6Color: NegroRecomendaciones de uso, limpieza y almacenaje:Uso: utilizar un lubricante a base de agua (nuestra recomendación: Desliz!)Limpieza: limpiador antibacteriano Limpín (en su defecto: agua y jabón neutro)Almacenaje: en su propia caja o en una bolsa individual, pero siempre separado de otros juguetes.Cómo se utiliza el masajeador de próstata ONIXONIX es un estimulador de los genitales masculinos que podrás utilizar de diversas maneras, en solitario o en compañía, ya que es compatible con la penetración.Si lo utilizas en pareja, ONIX se convertirá en un amigo que podréis sacar a pasear de vez en cuando y funcionará como un potenciador del placer y dinamizador de las relaciones, por ejemplo, usándolo con una felación. También, si lo usas en solitario, podrás utilizar el masajeador prostático  y combinarlo con una masturbación manual.Para colocarlo, te recomendamos que esperes a tener una erección, lubrica generosamente con algún lubricante de agua como Desliz!, y coloca primero la anilla en la base del pene para posteriormente introducir la otra parte del juguete en tu recto, para lo cual puedes usar un lubricante que favorezca la dilatación anal como lo es Bacanal Forte. Te recomendamos que lo laves antes y después con nuestro jabón bactericida Limpín, lo seques bien y lo mantengas alejado de otros juguetes, por ejemplo en una de nuestras bolsas de satén. ",https://www.amantis.net/onix-masajeador-de-prostata-perineo-y-testiculos-con-anilla/,False,False,False,False,True,True,True,False
117,117,SEVEN,fundas elásticas para el pene,"porque a ti te daban 2, y 3 y 4... ¡ahora quieres 7! ¿por que comprarte solo un juguetito? ¿por que quedarte con una sola funda de pene cuando puedes tener... 7? ¡si, 7! este kit de fundas elasticas para el pene augura erecciones, placer y diversion para cada dia de la semana.el lunes, puedes empezar con la funda de puntos. daras placer a picos a quien se deje penetrar; el martes, coges la cubierta de pezoncillos. resonaran sonrisas y cosquillitas en los recovecos de vuestros cuerpos; miercoles, combinais, y os quedais con la funda que combina puntos y pezones para recordar lo bien que os lo pasasteis al empezar la semana; y el jueves... ¡envoltura de triangulos! ¿celebrais que una funda ha entrado en vuestra vida?; viernes, ¡puntazo! llega la funda gruesa de puntos para los que necesitan emociones mas fuertes; y sabado... ¡todos juegan, pelillos y estrias por doquier!; y llego el domingo, santo dia, requiere para la ocasion que te enfundes la goma mas grande, la de los puntos mas ominosos, la que pretende hacerte recordar porque una funda vale un imperio. si es que llegas a domingo, claro...y si eres un begginner, no dejes de leer. quizas te estes preguntando: ¿para que me va a servir a mi una funda para el pene? pues se todo oidos, mister, porque si aun no lo probaste decirte que una funda vigoriza y lustra el pene y puede ayudarte a controlar tu eyaculacion y ademas, da a tu partner sensaciones y texturas antes impensables... como la moda, hombres y mujeres venimos al mundo guapxs y hermosxs, pero bien arregladitos, ¡somos preciosxs!","Colores: Negro, Transparente y Azul Limpieza: limpia el juguete antes y después de su uso con Limpín. O en su defecto, con agua tibia y jabón neutro.Material: TPR super flexibleMedida: diámetro regulable.Nota: Suspende el uso si notas cualquier molestia. ",https://www.amantis.net/seven-fundas-elasticas-el-pene/,False,False,False,True,True,False,True,False
118,118,RINGA,kit de anillos para pene en dos tamaños,"descubre el poder de ringa, tu kit de anillos para pene en dos tamaños diferentes, diseñado para brindarte control, placer y versatilidad en tu vida intima. 🎉 en amantis, nos comprometemos a ofrecerte productos que enriquezcan tu experiencia sexual, haciendola mas divertida, consciente y saludable. 🌱ringa esta compuesto por dos anillos, uno de 2,5 cm y otro de 3 cm de diametro interno, ambos fabricados con material resistente pero flexible, adecuandose perfectamente a distintas formas y tamaños. 🔄 con la opcion de elegir entre colores negro y transparente, podras disfrutar de discrecion y estilo al mismo tiempo. 👤🖤utiliza ringa para intensificar tus momentos de placer, colocandolo en diferentes partes segun tus necesidades: en la base para mantener la ereccion, en el glande para aumentar la sensibilidad o encima de los testiculos para retrasar la eyaculacion. ⏰🔥 no esperes mas para experimentar nuevas sensaciones y llevar tu vida sexual al siguiente nivel con ringa. 🚀 #placercontrolado #vidasexualsaludable","Anillos para peneMaterial: TPESin ftalatosDiámetro: 2,5 cm y 3 cmCómo se utilizan los anillos para pene RINGAPara utilizar esta anilla de placer es recomendable esperar a tener una erección y para su fácil inserción es recomendable que utilices algún lubricante de agua como Desliz!Es importante que la anilla se adecue al tamaño de tu pene para que haga su función correctamente y no apriete más de lo debido.¿Cómo saber si es un tamaño adecuado para mí?Calcula el diámetro de tu pene o del conjunto de tu pene y testículos.Réstale 3 mm para que la anilla quede prieta. La anilla debe presionar pero ¡no apretarte hasta el desmayo! Asegura que una vez colocada te cabe un dedo estirando la goma.Colócala con el pene semierecto y lubricanteÚsala máximo 20-25 minutos y no te quedes dormido con ella. ",https://www.amantis.net/ringa-anillos-para-pene-en-dos-tamanos/,False,False,False,False,False,False,True,False
119,119,GRASSHOPPER,anilla vibradora para tus dedos,"¿te gusta masturbarte con tus dedos? ¿te gusta sentir los dedos de tu amante acariciandote? te presentamos un invento que puede hacer esa experiencia aun mejor, la anilla para dedo grasshopper.¡que invento! por fin una anilla que te ayuda a hacer tu estimulacion manual mas placentera.coloca la anilla comodamente en dos de tus dedos o los de tu amante, activa la bala vibradora y emplea tus manos para explorar, profundizar, y palpar tu mundo interior y deja que la anilla estimule el clitoris y labios mientras tanto, con toda su potencia y sus 10 programas de vibracion.te recomendamos que calientes tus manos antes de empezar tu masaje y que emplees tu lubricante desliz! de agua favorito para hacer la experiencia mas fluida mas rica.",Conejito: 6.5cm X 1.5cmBala vibradora 6cm x 1.8cmAnilla diámetro 4cm aprox10 programas de vibraciónUsa 3 pilas LR44 incluidasSilicona y ABSSumergibleColor PúrpuraUsa Limpín limpiador antes y después de su usoTotalmente desmontable ,https://www.amantis.net/grasshopper-anilla-vibradora-tus-dedos/,True,False,False,True,False,False,True,False
120,120,MARATON MAN,arnés con dildo hueco de silicona de amantis,"por fin un pene hueco con arnes para poder prolongar tus sesiones amatorias hasta los 42 kilometros o mas alla. maraton man es un revolucionario artilugio sexual para ayudarte a mejorar tu marca, sea cual sea.son muchos los hombres que no consiguen una ereccion duradera, pero que quieren seguir participando activamente de sus relaciones sexuales con sus parejas y disfrutar de los momentos de intimidad y goce sin complicaciones, cirugias o pocimas milagrosas.en amantis llevabamos años ofreciendo soluciones a medias a todas esas personas, algunas eran muy grandes, otras eran muy rigidos, otras de materiales de mala calidad. pero, por fin tenemos una joya en nuestras tiendas y queremos compartirla contigo. bienvenido maraton man, te estabamos esperando desde hace tiempo.maraton man esta pensado para todos aquellos hombres deseosos de dar placer, sin tregua y sin pausa a sus amantes. dildos huecos en dos tamaños: mediano (13cm) y grande (16cm), diseñados en una suave y flexible silicona que te hara olvidar cualquier dildo hueco que hayas probado con anterioridad.este arnes tiene importantes detalles a destacar:dildo hueco, suave y flexible, con capacidad para alojar un pene con poca o ninguna ereccion.primeros 6 cm en el modelo grande, y primeros 4 cm en el mediano, partiendo desde el glande, son rigidos para facilitar los juegos de penetracion.base para la pelvis amplia, suave y flexible siendo esta una prolongacion del mismo dildo, diseño que ajusta este accesorio en perfecta sintonia con nuestra anatomia. es mas comodo y facil de usar. ademas, incorpora una prolongacion hueca inferior para acomodar los testiculos. de este modo el dildo estara perfectamente ajustado a tu cuerpo, fisica y visualmente.el arnes es una tira elastica que se ajusta a cualquier talla y desmontable. si, si, puedes quitarla para lo que quieras.estamos muy felices de participar en esta carrera. maraton man es un perfecto y claro ganador, sin tongos que valgan. ¡aplausos y eurekas!si deseas una experiencia mas intensa echa un visazo a maraton man intense con vibracion.","Material: dildo de silicona / cintura goma elásticaMedidas:Tamaño mediano 13 cm x 3 cm (Cavidad interior 9 cm x 2.5 cm)Tamaño grande 16cm x 4 cm (Cavidad interior 13 cm x 3.5 cm)SumergibleDesmontableTamaño de cintura adaptable desde 66 cm hasta 125 cmLimpieza y conservación: Limpialo antes y después de cada uso con agua tibia y jabón neutro, o un jabón bactericida como Limpín. Guarda tus juguetes alejados de la luz solar directa y de manera individual (no deben almacenarse nunca en contacto con otros) por ejemplo con nuestras bolsas de satén.No olvides acompañarlo con tu lubricante a base de agua preferido, como Desliz! Agua,  ",https://www.amantis.net/maraton-man-arnes-dildo-hueco-silicona-amantis/,False,False,True,True,True,True,True,False
121,121,MARSHALL,arnés de tela vaquera con 3 anillas,"eres una mujer con iniciativa y, aunque la naturaleza te ha dotado con otros dones, no te niegas a explorar placeres supuestamente ajenos. ¡di que si! ademas, nosotros estamos encantados de poner a tu disposicion productos para que puedas disfrutar de tu sexualidad al maximo. con el nuevo arnes vaquero de amantis, ¡armate con el dildo de tus sueños y adentrate en quien tu quieras, porque ya es posible!este arnes es totalmente ajustable, muy resistente y de color vaquero oscuro. ademas, al llevar unicamente la anilla, es compatible con dildos dobles, aquellos en los que tu te introduces un extremo en la vagina. con este arnes quedaran mucho mas sujetos y no tendras que preocuparte de que puedan salirse con el movimiento o en pleno fulgor de la batalla.si te gustan mas los dildos simples, este arnes tambien es compatible con ellos –siempre que sea un dildo de base ancha apto para arnes-. con este modelo encontraras tres anillas de tamaños diferentes, una de caucho y dos metalicas, para sujetar a la perfeccion el dildo que hayas escogido para la ocasion. las anillas quedan perfectamente fijadas al arnes gracias al doble sistema de sujecion mediante corchetes y velcros.si te decides por este arnes y deseas buscarle pareja, un pequeño cotilleo: ¡se lleva de maravilla con nuestro tandem de amantis! y tambien le hace ojitos a los glups de silicona y a nuestra fantastica coleccion avatar. en definitiva, que es un arnes muy dispuesto y totalmente poliamoroso.¿que dices, vaquera? ¿lista para una cabalgada?","· Fabricado en tejido dénim color oscuro, totalmente ajustable. · Incluye tres anillas de diferente tamaño (6cm, 4.5cm y 4cm); una de caucho y dos metálicas. · Compatible con cualquier dildo apto para arnés, incluso con los modelos dobles/tándem. · Se recomienda su lavado a mano y en agua fría. · Color único vaquero oscuro. · Talla única, se ajusta a cualquier tamaño. ",https://www.amantis.net/marshall-arnes-de-tela-vaquera-con-3-anillas/,False,False,True,True,False,True,True,False
122,122,LABRADORA,arnés estilizante y elegante,"¿preparada para ser una perra y sacarte a pasear tu solita? ahora eres tu la que tiene el poder con este maravilloso arnes de polipiel, imitador del cuero, 100% vegano, compatible con dildos aptos para arnes de base ancha. con el podras sexplorar otros roles, otras posturas, otros movimientos que te haran sentir empoderada y sentir lo que es tomar las riendas de un bonito paseo: la penetracion. el arnes labradora tiene un diseño muy especial, su geometria estiliza y marca tu cintura. es verdad que llevaras un pene colgando de ti, pero con este arnes tu feminidad queda completamente intacta. es un arnes totalmente ajustable y muy resistente, cuenta con dos sujeciones a los lados de la cintura y otras dos en las tiras traseras para que se ajuste a todo tipo de cuerpos. el resultado es como si fuera una braguita ajustable de imitacion piel que lleva incorporado un cinturon esteticamente fino y elegante. este arnes no cuenta con anilla, a diferencia de muchos otros modelos, pero esto no lo hace menos compatible con dildos que cuente con base o ventosa como nuestra coleccion de dildos avatar o nuestros glups! o lizo.",Producto VeganoComposición: 100% Poliéster Talla: ÚnicaColor: Negro y rojoLimpieza y conservación: Lavar con agua fría y utilizando productos de limpieza suaves o específicosDildo no incluido 	  ,https://www.amantis.net/labradora-arnes-sexual-elegante/,False,False,True,True,False,True,True,False
123,123,Arnés sexual VLAST,super fijación y estética fetish,"vas a una fiesta fetish y tu arnes para dildo no le pega ni con cola a tu atuendo de domina. ¿a quien no le ha pasado alguna vez? con este arnes tienes un 2en1 ideal, tanto si vas a tu local preferido como si te montas la fiesta en casa… sensualidad, poder y practicidad en una sola pieza. porque te sirve tanto de outfit fetish como para acoplar tu dildo preferido y convertirte en la reina de la noche.de tacto aterciopelado por dentro y de cuero sintetico por fuera. aqui la unica animal vas a ser tu. su diseño es de todo menos obvio y previsible. ¡fijate como luce por detras e imagina como van a seguirte con la mirada a tu paso! ademas, por si no fuera poco, es un arnes super comodo de llevar y ajustable a una gran variedad de cuerpos.¿sabes ya que dildo ponerte para la ocasion? por si te ayuda, te sugerimos nuestro maravilloso avatar ewok u otros modelos compatibles con arneses de anillas. ¡y acuerdate de añadirle siempre un poquito de lubricante!¿lista para no dejar a nadie indiferente?"," Arnés de cuero sintético 100% veganoNegro con anillas y tachuelas plateadasTalla única ajustable: 105 cm máximo cintura / 106 cm máximo caderas / 54.5 cm máximo ingle / 4 cm diámetro anilla para dildo Suave al tactoNo lavar en la lavadora. En caso de lavado, se recomienda hacerlo con un paño húmedo, a mano.No plancharDildo no incluidoAVISO: comprueba que este complemento se adapta a tus medidas antes de adquirirlo ",https://www.amantis.net/arnes-sexual-vlast-super-fijacion-estetica-fetish/,False,False,True,True,False,True,True,False
124,124,PRO ANAL,vibrador anal progresivo,"aventurarse en el sexo anal es entrar en un mundo lleno de placer y posibilidades que en amantis conocemos muy bien, por eso hemos diseñado pro anal 2 para ti, para que entres triunfante por la puerta de atras.su bonito diseño esta pensado para que el viaje sea facil, comodo y sobre todo placentero. su textura suave y sedosa y su estudiada anatomia lo convierten en un compañero ideal tanto si exploras estos territorios por primera vez, como si ya los conoces y simplemente quieres un aliado para seguir disfrutandolos. su punta finita y su cuerpo suave y que aumenta de grosor de manera gradual para que la penetracion sea mas facil.pro anal vibrador anal tiene 2 motores, uno en su delgada y suave punta, que gracias a su alta frecuencia de vibracion, estimulara, despistara y facilitara la dilatacion hasta del culo mas incredulo. su segundo motor esta en su cuerpo, para que disfrutes de sus vibraciones cuando hayas intimado un poco mas con el. juega con sus patrones de vibracion combinada sentiras como hipnoticamente pasa la vibracion de la punta a su base, invitando a sumergirte en un laberinto de placer cada vez mas complejo y lleno de matices. tienes 10 modos diferentes de vibracion y 5 niveles de potencia en cada uno.asi que tanto si eres principiante como si te encuentras ya en nivel experto en los placeres anales, abre la puerta a un mundo de sensaciones sorprendentes y explora todas las dimensiones del placer de la mano de pro anal 2, que por supuesto cuenta con todas las garantias de amantis y esta hecho con los mejores materiales y los mas respetuosos con tu cuerpo, ¡para que el viaje sea tan placentero como seguro!disfrutalo con un poco de lubricante anal y dejate ir a ese mundo lleno de matices, experiencias y sensaciones increibles que es el sexo anal.",Vibrador anal de punta extrafinaMaterial: silicona de grado médico. Anilla de ABS (seguro con el cuerpo)MedidasLongitud total: 18cm (12 insertables)Diámetro mínimo (en la punta): 0.6 cmDiámetro máximo en la parte más ancha: 2.7 cmRecargable (cargador USB incluido). 40 minutos de uso continuado*Cajita para guardarlo incluidaSilenciosoSalpicable (no sumergible)Colores: negro y púrpura ,https://www.amantis.net/pro-anal-2-vibrador-anal/,True,True,False,False,False,True,True,False
126,126,VOYAGE,tu vibrador a pilas de amantis,"que el fisico no es lo importante no es algo que le puedan decir a nuestro querido voyage. en este caso si lo es, y mucho, porque todo su cuerpo esta pensado para darte el maximo placer.toda la anatomia de este vibrador esta creada para estimularte; sus 9,5 cm de penetracion son un regalo para los sentidos interiores y la deliciosa curva de su punta no tiene otra razon que masajear tu punto g para hacerte estallar de gozo.voyage es el compañero de juegos ideal. su cuerpo de silicona de grado medico es tan, tan suave que te costara dejar de acariciarlo, y su potencia y flexibilidad te permitiran encontrar en el un compañero a la altura de las expectativas.con solo un boton podras controlar sus 9 modos de vibracion, y como voyage no necesita que lo cargues porque siempre esta con las pilas puestas, se convierte en un juguete super comodo de manejar que te aportara muchisimas horas de disfrute.asi que, si quieres un compañero de fiesta que te asegure que la noche acabara por todo lo alto, voyage promete no defraudarte.",Material: silicona de grado médico y mando de ABSVibración: 9 modosMedidas: largo 18 cm (9.5 cm penetrables); diámetro 4 cmSalpicable (IPX4)Color: fucsia o púrpura ,https://www.amantis.net/voyage-tu-vibrador-a-pilas-de-amantis/,False,False,False,False,False,True,True,False
127,127,BISOU 2,tiernos besos con lengua con la mejor vibración,"ya era hora de que nuestros estimuladores por ondas empezaran a tener nuevas formas y nuevas funcionalidades, por eso ha llegado bisou 2.sus suaves formas no dejan lugar a dudas: este juguete esta pensado para estimular tu punto g con 9 patrones distintos de vibracion y, al mismo tiempo, mimar a tu clitoris con los besos y lengüeteos mas tiernos y placenteros.ya sea porque has probado los succionadores de clitoris y quieres nuevas sensaciones, o porque te quieres lanzar a la piscina, has de saber que estas funciones son independientes, porque no todos los dias queremos el mismo tipo de estimulacion.siente temblar tu punto g sin renunciar a los mejores besos.","Vibrador para punto G y movimiento de lengua para el clítoris independientes Material: Silicona de grado médico Medidas: 13.3 cm totales de largo / 9.3 cm totales de ancho Dildo: 10.5 cm penetrables / 3.5 cm diámetro máximo Boquilla con lengua: 1.75cm de diámetro Lengua: 9 modos Vibración: 9 modos Recargable (cable USB incluido) Sumergible IPX7 Limpieza y conservación: Utiliza tu lubricante con base de agua favorito para cualquier tipo de juego sexual y obtener así, la mejor experiencia. No olvides lavar siempre tus juguetes después de cada uso, con un limpiador específico, como nuestro spray limpiador Limpín. Te recomendamos mantener los juguetes separados entre sí, en un lugar seguro y seco. Puedes utilizar nuestras bolsas de terciopelo en diferentes tamaños. ",https://www.amantis.net/bisou-2-besos-lengua-succion/,False,False,False,True,False,True,True,False
128,128,SHUP! Succionadores de pezones,,"maxima adaptabilidad unisex y precision extrema.¡pezones arriba! ¡esto es un gustazo! realizados en una pieza unica de suave y elegante silicona higienica, ofrecen un diseño perfecto para generar el vacio alrededor de cada pezon con una adaptabilidad, precision y comodidad pocas veces vistas en este tipo de accesorios… ¡hasta ahora!cada unidad ofrece un deposito hueco en forma de esfera con relieves antideslizantes para una manipulacion optima, ademas de una apertura sin aristas en forma de generosa ventosa que consiguen una adaptacion perfecta a cualquier tipo de senos y/o tipos de pezon.cuanto mas apretemos para extraer el aire antes de posar la apertura sobre nuestro pezon, mas intenso sera el efecto de succion... y mas erecto y sensible quedara para la ocasion. olvidate de perder el tiempo luchando para adaptar la capsula al pecho sin fugas de aire, o de no poder controlar la fuerza de succion al gusto de cada pezon: su diseño y acabados estan tan bien pensados que no tendras problemas para succionar al gusto sin complicaciones.esta pareja exclusiva de shup! succionadores de pezones van a levantar tantas pasiones y sensaciones… como pezones -de cualquier tamaño, genero y condicion- se pongan al alcance de sus succiones.¿seran los tuyos, o los de la persona que adores?"," · x2 unidades. · Sin juntas. Molde único. · Silicona 100% higiénica. · Máxima adaptabilidad y eficacia. Medidas x unidad: · Diámetro cápsula: 3,5cm. · Diámetro ventosa de contacto: 5,5cm.· Longitud Total: 7cm.(!) No emplear sobre heridas abiertas, hematomas o superficies laceradas. Evitar el contacto directo con aceites minerales y lubricantes grasos. ",https://www.amantis.net/shup-succionadores-pezones/,False,False,False,False,False,False,True,False
