ID,PRODUCT,SLOGAN,DESCRIPTION,CHARACTERISTICS,LISTA_URL,amenities,anal,BDSM,femenino,masculino,juguetes,lenceria,muebles
54,ONIX,"masajeador de próstata, perineo y testículos con anilla","¿quieres explosionar estimulando todas tus zonas erogenas de manera simultanea? onix es un masajeador de prostata, perineo y testiculos con anilla incorporada. ¿todo a la vez? si, todo a la vez. esta pensado para estimular todos los puntos erogenos de los genitales masculinos y elevarte a cotas maximas de placer si lo compaginas tambien con relaciones sexuales.onix se compone de dos partes unidas entre si:por un lado, encontramos el vibrador prostatico con un diseño ergonomico que se adaptara perfectamente a nuestra anatomia. al final del mismo apreciamos una bolita saliente que acariciara nuestra prostata. en la union, el juguete mantiene su rigidez para que nuestro perineo tambien reciba placer.por el otro, encontramos un masturbador masculino que envolvera los testiculos y los estimulara con su vibracion, ademas de tener una anilla que ira situada en la base del pene para ayudar a retrasar la eyaculacion.este juguete nos ofrece 9 patrones de vibracion que recorreran los mayores puntos de placer de nuestros genitales. ademas, es salpicable y muy silencioso.","Medidas: 15,8 cm x 12,8 cm x 5,3 cmMaterial: silicona + ABS9 modos de vibraciónTipo de carga: mediante cable USB (incluido)Sumergible IPX6Color: NegroRecomendaciones de uso, limpieza y almacenaje:Uso: utilizar un lubricante a base de agua (nuestra recomendación: Desliz!)Limpieza: limpiador antibacteriano Limpín (en su defecto: agua y jabón neutro)Almacenaje: en su propia caja o en una bolsa individual, pero siempre separado de otros juguetes.Cómo se utiliza el masajeador de próstata ONIXONIX es un estimulador de los genitales masculinos que podrás utilizar de diversas maneras, en solitario o en compañía, ya que es compatible con la penetración.Si lo utilizas en pareja, ONIX se convertirá en un amigo que podréis sacar a pasear de vez en cuando y funcionará como un potenciador del placer y dinamizador de las relaciones, por ejemplo, usándolo con una felación. También, si lo usas en solitario, podrás utilizar el masajeador prostático  y combinarlo con una masturbación manual.Para colocarlo, te recomendamos que esperes a tener una erección, lubrica generosamente con algún lubricante de agua como Desliz!, y coloca primero la anilla en la base del pene para posteriormente introducir la otra parte del juguete en tu recto, para lo cual puedes usar un lubricante que favorezca la dilatación anal como lo es Bacanal Forte. Te recomendamos que lo laves antes y después con nuestro jabón bactericida Limpín, lo seques bien y lo mantengas alejado de otros juguetes, por ejemplo en una de nuestras bolsas de satén. ",https://www.amantis.net/onix-masajeador-de-prostata-perineo-y-testiculos-con-anilla/,False,False,False,False,True,True,True,False
55,LAZZO,funda con anillo doble para pene,"te agarra la base del pene pero para dar rienda suelta a una potente y duradera ereccion. te presiona el glande pero para liberar su costumbre al tacto y darle una nueva sensibilidad.y teniendo todo lo necesario bien atado, lazzo desatara tambien un placer extra en la penetracion haciendola mas completa y estimulante, no solo para ti, tambien para tu acompañante. esto es debido a la existencia de un reborde en la parte superior del juguete para la estimulacion de punto g o punto p.como sabemos el punto g se ubica en la pared frontal de la vagina, a unos cinco centimetros de la entrada, tiene una textura rugosa facil de identificar pero dificil de estimular solo con la penetracion en algunas posturas. y lo mismo pasa con el punto p.decora tu pene con este maravilloso lazzo y conviertelo en el regalo que todo punto g y p desean recibir.","Funda para peneMaterial: Silicona MédicaMedidas: 14,2 cm de largo. 3,2 y 3,4 cm de diámetro de anillas inferiores. 4,7 cm de anilla superior.Sumergible 	 Cómo se utiliza el anillo para pene WUFF WUFFPara utilizar esta anilla es recomendable esperar a tener una erección y para su fácil inserción es recomendable que utilices algún lubricante de agua como Desliz!Es importante que la anilla se adecue al tamaño de tu pene para que haga su función correctamente y no apriete más de lo debido.¿Cómo saber si es un tamaño adecuado para mí?Calcula el diámetro de tu pene o del conjunto de tu pene y testículos.Réstale 3 mm para que la anilla quede prieta. La anilla debe presionar pero ¡no apretarte hasta el desmayo! Asegura que una vez colocada te cabe un dedo estirando la goma.Colócala con el pene semierecto y lubricanteÚsala máximo 20-25 minutos y no te quedes dormido con ella. ",https://www.amantis.net/lazzo-funda-anillo-doble-pene/,False,False,False,False,False,False,True,False
56,TOTEM,anilla para pene,"si te contamos que el placer carnal se puede potenciar con tecnicas naturales y ancestrales, ¿te dan ganas de probarlas? presionar la base del pene, de los testiculos o de todo el conjunto son tecnicas usadas en la historia para jugar con la potencia de ereccion, la sensibilidad del pene y los tiempos de eyaculacion. las anillas, mas conocidas como cock rings en ingles, son usadas para esta suerte de juegos placenteros entre las sabanas. hay muchas formas de usar tu totem, pero te proponemos que empieces por estas:si pones tu anilla en la base del pene (por delante de los testiculos): estas anillas ejercen presion en la base del pene consiguiendo un engrosamiento del mismo y una ereccion mas duradera. la sensibilidad en este varia y en los juegos de pareja ambas partes lograran sacar provecho de este nuevo juego carnal. si la pones en la raiz del pene (por detras de los testiculos): ademas de aportar endurecimiento, grosor y durabilidad de la ereccion (como la anterior), esta anilla ejerce tambien una presion en los testiculos, lo que erotiza la vista al mismo tiempo que sensibiliza la zona y ayuda a controlar la eyaculacion por la presion de la anilla sobre el conducto deferente.","​​​​Material: 100% silicona.Suaves y elásticas.Color: negro.Medidas diámetro interior: 3.5 cm (tamaño 1); 4 cm (tamaño 2); 4.2 cm (tamaño 3); 4.6 cm (tamaño 4); 5 cm (tamaño 5).Cómo se utiliza la anilla para pene TOTEMPara utilizar esta anilla es recomendable esperar a tener una erección, y para su fácil colocación es recomendable que utilices algún lubricante de agua como Desliz!Es importante que la anilla se adecue al tamaño de tu pene para que haga su función correctamente y no apriete más de lo debido.¿Cómo saber si es un tamaño adecuado para mí?Calcula el diámetro de tu pene o del conjunto de tu pene y testículos.Réstale 3 mm para que la anilla quede prieta. La anilla debe presionar pero, ¡no apretarte hasta el desmayo! Asegúrate de que una vez colocada te cabe un dedo estirando la goma.Colócala con el pene semierecto y con lubricante.Úsala un máximo de 20-25 minutos y no te quedes dormido con ella. ",https://www.amantis.net/totem-anilla-para-pene/,False,False,False,False,False,False,True,False
59,PASTORA,potente arnés sexual de sujeción firme,"¿buscas un arrnes seguro, potente y que sujete bien todas tus perrerias?el arnes pastora es un arnes con una presencia potente, para mujeres que dominan cuando y donde quieren entrar, cuanto tiempo se quieren quedar y, lo mas importante, cuando se quieren ir. el arnes pastora tiene una potente base en forma de pentagono que cubrira en su totalidad tu zona genital consiguiendo que el dildo que elijas quede completamente pegado a tu pubis, haciendo del roce, el cariño gozoso. este arnes es para aquellas personas que se acercan a sentir cierto fetiche por el cuero, pero tambien para las que se preocupan por el bienestar de los animalillos; el material del que esta hecho es polipiel, que no es cuero, pero se parece mucho.las tiras, muy sencillas de ajustar, han sido diseñadas con un ancho generoso, y la parte trasera, tipo tanga, dejara esta zona libre de ataduras y lista para que te agarren y aprieten mientras tu transitas la perra salvaje que llevas dentro.    cuenta con una anilla metalica que tiene un tamaño estandar haciendola compatible con la gran mayoria de tamaños de dildos, siempre que cuenten con base o ventosa. ¿ya sabes con que tipo de dildos puedes empezar a ladrar? conoce nuestra coleccion de dildos avatar o nuestros glups! o lizo.",Composición: Polipiel Producto VEGANOTalla: ÚnicaColor: Negro Limpieza y conservación: Lavar con agua fría y utilizando productos de limpieza suaves o específicosDildo no incluido ,https://www.amantis.net/pastora-potente-arnes-sexual-de-sujecion-firme/,False,False,True,True,False,True,True,False
60,BOXER,cómodas braguitas ajustábles con función de arnés,"el placer por lo comodo existe, ¿eres de las que para perrear busca siempre la comodidad? en amantis traemos un imprescindible en nuestra coleccion de arneses. el arnes boxer te hara sentirte tu por su simplicidad, por su parecido a las braguitas que has llevado toda la vida. a esas amables y acogedoras braguitas le añadimos un hueco para que introduzcas tu dildo favorito, este hueco esta abierto por dentro, asi que tambien podras usar dildos dobles. por lo demas, poco las separa de esas braguitas con las que te sientes muy tu, esas que te apetece llevar a veces sin mas parafernalia. gracias a la elasticidad del cinturon superior y la apertura lateral con comodos velcros las haran ajustables al tamaño de tu cintura.  estan hechas de poliester y algodon con costuras que apenas notaras y de una anchura generosa para que la sujecion sea mayor y mas segura. este arnes no contiene anilla pero el agujero tiene un tamaño estandar que la hace compatible con la gran mayoria de tamaños de dildos, siempre que cuenten con base o ventosa. haz que tu pareja sexual crea que son unas braguitas normales, y en medio de tanta normalidad dile que quieres salir a pasear por el interior de sus fantasias…¿ya sabes con que tipo de dildos puedes empezar a ladrar? conoce nuestra coleccion de dildos avatar o nuestros glups! o lizo.",Composición: 100% Poliéster y algodón.Talla: ÚnicaColor: NegroLimpieza y conservación: Lavar con agua fría y utilizando productos de limpieza suaves o específicos ,https://www.amantis.net/boxer-braguitas-arnes/,False,False,True,True,False,True,True,False
61,Arnés sexual TRIANGLE,100% vegano con brillo y sujeción firme,"en los juegos del amarse y disfrutarse todo puede ser tan complicado o sencillo como los amantes decidan que sea. pero si hay una cosa que tenemos clara en amantis, es que nuestros juguetes apuestan por darle armonia, naturalidad y pasion a cada encuentro, y por eso seguimos ampliando nuestra seleccion de arneses, para que cada cual encuentre el suyo.arnes triangle de polipiel es el fin de la busqueda del acople perfecto con el minimo tiempo y esfuerzo.su base triangular se adapta a la perfeccion a la pelvis ademas de estar acolchada, lo que hace que sea comoda de vestir. el acabado es leather style, pero recordamos que en amantis no usamos piel natural, por lo que tienes un acabado tipo cuero, sin sufrimiento animal. las tiras del arnes te enmarcaran la cintura y los gluteos, asi de espaldas lo veras tipo braguita. lo dicho: sencillo, facil y comodo de poner, para evitar eso de andar buscando los huecos por donde meter las piernas…la anilla desmontable de goma tiene 4 cm de diametro. en ella puedes albergar dildos (el dildo de las fotos no esta incluido) con base de ventosa a partir de esa medida, o cambiarla por otra que se adapte al juguete que quieras utilizar. las tiras del arnes son de suave algodon y acariciaran tus lineas corporales a la vez que lo haran las manos de tu amante pidiendote mas y mas pasion.puedes usar este arnes con dildos de base ancha como ewok de la gama avatar de amantis, y recordamos que el uso de un lubricante a base de agua como desliz y tu limpiador bactericida favorito limpin son ideales para disfrutar completamente de la experiencia y alargar la vida de tus juguetes.","Material: polipiel y algodónAnilla de caucho de 4 cm de diámetro (desmontable e inercambiable) Medidas: para caderas de hasta 134 cm, cinta de glúteos máximo 68 cmDildo no incluido ",https://www.amantis.net/arnes-sexual-triangle-100-vegano-con-brillo-y-sujecion-firme/,True,False,True,True,False,True,True,False
62,TROMPI,vibrador sumergible ideal para punto_g,"trompi es ideal, suave, blandito, flexible en su justa medida, maravilloso para juegos de entrada y de salida, para acariciar por fuera, para rozar por dentro, girando, apalancando o profundizando hasta el fondo de tu ser. a solas maravilloso, en buena compañia: disfrutable todo el dia. quiza por eso se ha convertido rapidamente en uno de los best sellers mas queridos en amantis.el punto-g femenino se ha puesto en duda durante demasiados años, y aun hoy hay que sigue cuestionando su existencia. pues bien, hoy te traemos la ultima maravilla amantis: trompi, este juguete tan mono es nada mas y nada menos que un vibrador ideal para todas aquellas personas con vagina que buscan una herramienta suave y delicada para estimular su punto-g.fabricado en silicona de grado medico, trompi te cautivara por la elegancia que dibujan sus formas y la extrema suavidad de su acabado. pero eso no es todo, prueba a sostenerlo entre tus manos y descubre lo blandito que es... ¡nunca habiamos visto nada igual! existen muchos estimuladores para punto-g en el mercado, pero este… ¡este se lleva la palma! disfruta de la flexibilidad de su tronco sin perder un apice de firmeza en el extremo plano diseñado especificamente para estimular la zona del punto-g.explora tu cuerpo y explora tu deseo con trompi, el nuevo estimulador de punto-g de amantis. regalate hoy mismo un buen masaje vaginal al ritmo que solamente tu desees gracias a sus nueve funciones vibratorias distintas. ademas, recuerda que este juguete no solo es de uso interno. en realidad, vale para estimular cualquier zona erogena del cuerpo. y, si no te lo crees, ¡haz la prueba! presiona suavemente su extremo plano contra tu vulva, clitoris, perineo, vientre, muslos, espalda, nuca… ufff ¡se nos ocurren tantas posibilidades que ya estamos empezando a salivar!ergonomico, compacto, suave, flexible… ¿que mas quieres? ¡llevate esta monada a casa y disfruta de tu punto-g como nunca antes lo habias hecho!","Contiene: vibrador + cable USB + instrucciones Medidas: vibrador (17.7cm x 3,6cm extremo inferior x 3cm extremo superior) Materiales: silicona de grado médico + plástico ABS (acrilonitrilo butadieno estireno) Recargable cable USB incluido Sumergible IPX7 Color: púrpura o fuscia Uso: con lubricante a base de agua (nuestra recomendación: Desliz!) Limpieza: limpiador antibacteriano Limpin (en su defecto: agua y jabón neutro) Almacenaje: en su propia caja o en una bolsa individual (bolsas amantis), pero siempre separado de otros juguetes. ",https://www.amantis.net/trompi-vibrador-sumergible-ideal-punto-g/,False,False,False,True,False,True,True,False
63,TOBOGANE,el vibrador doble más vendido,"por favor, desabrochense los cinturones de seguridad. las curvas mas atractivas y emocionantes que hayas probado te estan esperando. disfruten del nuevo tobogane hot.creenos, subir a tobogane puede ser una de las elecciones mas estimulantes que hayas tomado. tan solo con sacarlo de su exclusiva caja y acariciar su suave silicona y sus formas semi-flexibles te haran sentir un escalofrio de placer.... y te robara una sonrisa al pensar que se sentira.pero las prestaciones de tobogane van mas alla y lo hacen unico en su categoria, su sencillo sistema de control, sus 10 modos de vibracion en dos zonas, su nuevo efecto calor independiente, su sistema de carga y que lo puedas sumergir lo hacen totalmente unico, y ¿su precio...? ah si su precio... tan ligero, casi inapreciable.de tamaño perfecto, ni muy grande ni muy pequeño, sirve para iniciarse en el mundo de la fantasia para adultos, en el cosquilleo anal, e incluso para disfrutar en pareja sin que nadie se sienta desplazado. activa su efecto calor, y disfruta de una sensacion calida para una introduccion suave y sin sobresaltos.la ultima atraccion exclusiva de amantis es mas que tentadora... es irresistible, lo sabemos. ¿quieres emociones? subete a tobogane hot antes de que se agote.","Vibrador con doble motor. Medidas:  19cm, (11cm de penetración) diámetro máximo 3,3cm, mínimo 2,2cm. 2 motores independientes. Material: silicona de grado médico (100% compatible con el cuerpo). Ergonómico y de fácil manejo. Sumergible. Recargable por puerto USB, incluye cable. Contiene estuche rígido de guardado y bolsita de satén. 10 modos de vibración ultra silenciosa. Efecto calor (a los pocos segundos se calentará hasta 39 grados) ",https://www.amantis.net/tobogane-el-vibrador-doble-mas-vendido-ahora-efecto-hot/,False,True,False,False,False,False,True,False
65,SUCCIÓN PROFUNDA,kit de desarrollo y placer para hombre,"succion profunda es un kit que viene cargado de sorpresas para satisfacerte en todos tus deseos.podras olvidarte de los desarrolladores manuales: obten las ventajas de un desarrollador, casi casi manos libres. simplemente introduce tu pene en el cilindro, y activa la succion en una de sus tres intensidades para sentir y observar gracias a su cilindro transparente y reglado como crece y se endurece tu miembro. despues solo tendras que deslizar una anilla para mantener el tamaño y la ereccion conseguidas.o bien, dejate estremecer por la sensacion mas real gracias a su suave manga masturbadora, que te invitara a ir cada vez mas profundo con sus ligeros toques de succion.¿quieres mas? añadele vibracion y preparate para ver las estrellas. asi, en un sencillo movimiento, convierte tu desarrollador en tu juguete favorito y no te olvides de añadir unas gotas de tu lubricante a base de agua preferido como desliz! eco natural.¡no querras parar!","Incluye cable cargador con puerto USB, manual de instrucciones en inglés, manga masturbadora con apariencia de vulva, cilindro desenroscable y acople de entrada para el cilindro.Antes de utilizarlo en el pene, prueba en tu brazo o pierna la succión que ofrece, para hacerte una idea de la intensidad que proporciona cada uno de sus tres niveles.Tras su utilización, limpia los artículos por separado con agua tibia y un jabón bactericida, como nuestro Limpín. Asegúrate de que los componentes están completamente secos antes de guardarlos.Recargable cable USB incluido. Carga completa en 2.5 hVibración: 9 modosMateriales: ABS, TPR y Silicona. Sin Latex y Sin FtalatosMedidas:Tamaño total montado: 31.4 cmLongitud del cilindro: 22 cmDiámetro del acople de entrada: 8.6 cmDiámetro penetrable del acople: 2.2 cmDiámetro total de la manga masturbadora: 9.5 cmLongitud total de la manga masturbadora: 13.5 cmSumergible  IPX7 has de asegurarte de que su interior queda bien seco antes de guardarlo en caso de que lo hayas sumergido. Si no lo haces sumotor podría dañarse  ",https://www.amantis.net/succion-profunda-kit-desarrollo-placer-hombre/,True,False,False,False,False,False,True,False
66,ALFA | Succionador de clítoris palpitador,,"alfa es superior cuantitativamente, ¡lo tiene todo!alfa es un vibrador multifuncion: succiona, puntea, vibra y palpita. ¿como te quedas?las sensaciones seran nuevas y muy completas, ya que tiene una infinidad de combinaciones, pudiendo transitar una senda orgasmica interminable.la estimulacion externa de alfa cuenta con un succionador que, a su vez, cuenta con una pequeña lengüita localizadora de puntos muy precisos de ese pequeño organo lleno de terminaciones nerviosas llamado clitoris. al ser una lengüeta muy pequeña sera curioso darle otros usos para puntear diminutos espacios de placer como pezones o ano. la parte que une el succionador con el otro extremo es completamente flexible, permitiendo que puedas elegir la funcion doble o, por el contrario, dejar la parte interna del juguete fuera. esta parte interna gana en tamaño cogiendo forma abombada con una funcion palpitante muy potente, una parte movil que se mueve al son de tus palpitaciones naturales y orgasmicas. por supuesto, aparte de succionar, chupar y palpitar, tiene nueve patrones de vibracion que podras ir modulando a tu gusto.seras una hembra alfa con el control total de tu placer, ¡todo un reto!como se utiliza alfa - succionador de clitorisposa alfa sobre tu clitoris y conforme vayas sintiendo excitacion, podras acompañarlo de tus propios movimientos circulares, aplicando presion, o retirandolo de vez en cuando para aumentar el deseo.no olvides acompañarlo con tu lubricante a base de agua preferido, como desliz!, y limpiarlo antes y despues de cada uso con agua tibia y un jabon neutro, o un jabon bactericida como limpin. secalo bien antes de guardarlo y mantenlo alejado de otros juguetes, por ejemplo en una de nuestras bolsas de saten.","Medidas: 11,2 cm x 3,6 cm x 2 cmMaterial: silicona + abs9 modos de vibraciónTipo de carga: mediante cable USB (incluido)Sumergible IPX7Color: MoradoRecomendaciones de uso, limpieza y almacenaje:Uso: utilizar un lubricante a base de agua (nuestra recomendación: Desliz!)Limpieza: limpiador antibacteriano Limpín (en su defecto: agua y jabón neutro)Almacenaje: en su propia caja o en una bolsa individual, pero siempre separado de otros juguetes. ",https://www.amantis.net/alfa-succionador-de-clitoris-palpitador/,True,False,False,True,False,True,True,False
67,DIAMANTE,vibrador de succión y masaje,"descubre la fusion perfecta de diseño y placer con diamante, un innovador vibrador de succion y masaje que promete llevarte al extasis. con un extremo dedicado a masajes intimos internos y otro que ofrece una suave y precisa succion clitorial, diamante esta diseñado para brindarte una experiencia de placer completa y sofisticada. su elegante boton de encendido decorado con una piedra de cristal simula un diamante, añadiendo un toque de lujo a tus momentos de intimidad.especificaciones:nombre: vibrador diamante con succion y masajelongitud: 220 mmcabezas de estimulacion: un extremo con succion y otro con vibracionmaterial: silicona de grado medico y abs para garantizar seguridad y durabilidadcolor: negro profundo, para una apariencia elegante y sofisticadacontroles: boton de encendido decorado con piedra de cristal, que ofrece un toque de elegancia a tu experiencia de placerflexibilidad: diseño adaptable al cuerpo para comodidad y estimulacion dirigidaimpermeabilidad: si",":Estimulación Dual: Experimenta lo mejor de ambos mundos con potentes vibraciones y suave succión clitorial.Diseño Ergonómico: DIAMANTE es una obra de arte en ergonomía y placer, diseñado para máxima comodidad y facilidad de uso.Modos Múltiples: Variedad de ajustes de vibración y succión para encontrar tu combinación perfecta y alcanzar una satisfacción inigualable.Recargable: Conveniencia de carga USB, proporcionando horas de placer ininterrumpido.Silencioso: La tecnología avanzada asegura que DIAMANTE opere discretamente para disfrute privado.Incluye en el Paquete:1 x Vibrador DIAMANTE con Succión y Masaje 1 x Cable de Carga USB 1 x Manual de UsuarioVive la experiencia de lujo y satisfacción con DIAMANTE, tu nuevo secreto mejor guardado para la relajación y disfrute personal. ",https://www.amantis.net/diamante-vibrador-de-succion-y-masaje/,False,False,False,False,False,True,True,False
