ID,PRODUCT,SLOGAN,DESCRIPTION,CHARACTERISTICS,LISTA_URL,amenities,anal,BDSM,femenino,masculino,juguetes,lenceria,muebles
0,PACHA,succionador y vibrador punto g,"como casi todo el mundo sabe, el succionador arraso en el mundo del placer, y tuvo y tiene sus años de gloria. el placer empieza a estar de moda y por eso no paramos de venir con novedades que te haran ir cada vez mas lejos.pacha es un juguete muy completo que abrazara tu vagina y tu vulva acoplandose especialmente bien a tu anatomia. un estimulador por ondas, o succionador como mas comunmente se conoce, y un vibrador ahuevado para introducir en nuestra vagina en el mismo juguete. si no sabes si decidir entre la estimulacion interna o externa, ¿por que no tener las dos a la vez?estos vibradores tienen una silueta suave y forma una curva que se adaptara a nuestra zona pelvica permitiendo una estimulacion doble, tanto en nuestro clitoris como en nuestro punto g. el estimulador de ondas de pacha no es como los demas succionadores, pues su programacion de nueve frecuencias diferentes tiene programas de baja intensidad y algunos que juegan con dejar espacios sin nada. el succionador de pacha pone el foco en alargar la fase de la excitacion previa al orgasmo. es un succionador que por su programacion no sobreestimula el clitoris, sino que respeta sus tiempos y le da una de cal y otra de arena.ademas tiene una asa justo en la parte de la articulacion, y esto es toda una novedad, ya que hace que un juguete que es, aparentemente, de posicion fija, se convierta en un juguete movil con el que podremos jugar a juegos de entrada y salida. tambien nos permitira acomodar el estimulador de ondas en la zona donde queramos de una manera facil y manejable, independientemente de si nuestro clitoris esta mas abajo o mas arriba.otra ventaja que nos ofrece el asa es la posibilidad de retirarlo en los segundos posteriores al orgasmo para evitar cualquier molestia. el asa tambien es un gran aliado de nuestro amantes, pues tendran un grado mas alto de participacion a la hora de jugar con nosotras y nuestros juguetes.recibiras besos tiernos y placenteros en tu clitoris, asi como vibracion en tu interior. se trata de un vibrador punto g con el que podras elegir entre 9 patrones de vibracion en la zona del dildo y disfrutar de la estimulacion interna y externa a la vez, que es toda una delicia. el hecho de que podamos estimularnos por ambas zonas al mismo tiempo hara que tengamos un orgasmo interconectado y sera mucho mas intenso.los orgasmos intensos no solo nos interesan por el placer en si, que tambien, sino porque hacen que los beneficios de los mismos se potencien, asi pues, tendremos la piel mas brillante, estaremos de mejor humor, disminuimos el estres y favorecemos el sueño.","Vibrador con succión sónicaMedidas: 13 cm largo, 3.5 cm anchoMateriales: Silicona de grado médico + ABS2 horas de uso continuado120 minutos para una carga completa9 modos de vibración9 modos de succiónSumergible IPX7Recargable (cargador USB incluido)SilenciosoCómo se usa PACHA, vibrador succionador Punto G.Puedes empezar utilizando la vibración para poder activar el circuito de placer; con la misma vibración podrás despertar al cuerpo y avisarle que se prepare para recibir placer.Para comenzar con la estimulación doble, te recomendamos que introduzcas primero el dildo en tu vagina y luego acomodes la parte del clítoris. No todas tenemos el clítoris en el mismo sitio, así que tómate el tiempo que necesites para hacerlo coincidir y usa el asa para poder acomodarlo lo mejor que puedas. ¡No tengas prisa!Ya sea porque has probado los succionadores de clítoris y quieres nuevas sensaciones, o porque te quieres lanzar a la piscina, has de saber que estas funciones son independientes. Poniendo al revés este juguete, podremos usar solo la parte del succionador y combinarlo con una penetración en pareja.No olvides acompañarlo con tu lubricante a base de agua preferido, como Desliz!, y limpiarlo antes y después de cada uso con agua tibia y un jabón neutro, o un jabón bactericida como Limpín. Sécalo bien antes de guardarlo y mantenlo alejado de otros juguetes, por ejemplo en una de nuestras bolsas de satén. ",https://www.amantis.net/pacha-succionador-y-vibrador-punto-g/,False,False,False,True,False,True,True,False
1,TOCCATA,vibrador doble con anilla masajeadora,"no vas a poder parar de tocarte con este maravilloso juguete erotico muiltifuncion. en amantis nos gusta dar placer a todo el mundo, asi que cada vez os traemos mas opciones, cada vez mas juguetes adaptados a todos los gustos.tienes ante ti un juguete que enamora por su diseño moderno y sofisticado, sus preciosos colores y por una de sus sorprendentes funciones.toccata es un vibrador doble con funcion palpitadora en el clitoris. tiene doble motor, por lo que podras activar la vibracion interna y externa de manera independiente.el bracito externo de este vibrador punto g tiene forma de cola de ballena acabada en punta, y en la zona interna tiene un ovalo que palpita, es decir que se mueve de delante hacia atras, dando un placer extremo a tu clitoris. la palpitacion puede parecerse a la vibracion en intensidades muy altas, el palpitador de nuestro precioso. toccata tiene siete combinaciones ritmicas diferentes que haran que tu vagina palpite al son del placer mas profundo.toccata llega para traernos sensaciones nuevas y diferentes. la parte del dildo esta rodeada por una anilla con pequeños relieves que viaja desde la base del dildo hasta la punta del mismo de siete maneras diferentes, alternando ritmos y velocidades. esta anilla masajea con fuerza todo nuestro conducto vaginal creando sensaciones muy intensas. tambien puedes usar esta anilla que se mueve para dejarte hacer un masaje externo e integral en la vulva. si te gustan las sensaciones fuertes, deja que toccata te enseñe el camino.este vibrador tiene la forma clasica de un dildo doble de tamaño considerable y gracias a su diseño inteligente, es un juguete erotico mulitfuncion. tiene tres motores que podras activar por separado, por lo que podras ir alternando el orden en el que usas el juguete haciendo que cada sesion masturbatoria sea unica e irrepetible. la parte con forma falica es completamente rigida y recta, gracias a esta rigidez podremos tener mas margen de impacto y fuerza en las zonas donde sintamos mas placer.","Medidas largo: 22 cmMedida máxima diámetro: 3 cmMaterial: silicona + abs7 modos de vibración7 velocidades de palpitación7 velocidadesd en la anillaTipo de carga: mediante cable USB (incluido)Salpicable IPX4Color: Verde esmeraldaCómo se utiliza el vibrador doble TOCCATAAntes de probar la anilla masajeadora en los genitales, puedes probar la sensación en zonas menos sensibles de tu cuerpo para saber qué esperar e ir de menos a más.Este juguete tiene tres botones, apretando el botón de en medio con una pulsación larga, encenderás el juguete. Con el botón de arriba encenderás la vibración del dildo, el botón de abajo es para activar las diferentes combinaciones rítmicas de la función palpitadora, y el botón de en medio para activar el sube-baja de la anilla.Te recomendamos siempre usar uno de nuestros lubricantes a base de agua como Desliz! para favorecer la penetración y aumentar el placer.No olvides limpiar antes y después de usarlo con agua tibia y un jabón neutro, o un jabón bactericida como Limpín. Sécalo bien antes de guardarlo y mantenlo alejado de otros juguetes, por ejemplo en una de nuestras bolsas de satén. ",https://www.amantis.net/toccata-vibrador-doble-con-anilla-masajeadora/,False,False,False,True,False,True,True,False
2,DESIDERIUM: El Arte del Placer Dual,,"estimulacion especializada: experimenta la doble satisfaccion con desiderium, diseñado meticulosamente para la estimulacion simultanea del punto g y el clitoris. cada curva y contorno ha sido pensado para ofrecerte un placer inigualable y personalizado.vibracion potente y calentamiento: sumergete en olas de placer con dos motores potentes que ofrecen vibraciones intensas, acompañadas de una funcion de calentamiento que aporta una sensacion increiblemente realista. desiderium te lleva desde suaves caricias hasta intensos terremotos de placer.silicona de grado medico: confeccionado con la mas alta calidad de silicona, suave, segura para el cuerpo y libre de ftalatos. desiderium es hipoalergenico, ofreciendo una experiencia segura y sensual.dimensiones: longitud total de 200 mm con un diametro variable de 27 a 37 mm, perfecto para encontrar y estimular cada punto sensible.recargable y resistente al agua: nunca te preocupes por las baterias; desiderium es recargable y ofrece horas de uso con una sola carga. ademas, es completamente resistente al agua, lo que significa que puedes llevar tu juego a la ducha o la bañera.compromiso con tu privacidad:entendemos la importancia de la discrecion. por ello, todos los pedidos de desiderium se envian en paquetes neutros, asegurando tu privacidad desde el momento de la compra hasta la entrega. ademas, te ofrecemos envio gratuito para que puedas disfrutar de desiderium sin preocupaciones adicionales.descripcion del producto:desiderium no es solo un vibrador; es una invitacion a explorar los limites de tu placer. con su capacidad para estimular intensamente el punto g y el clitoris al mismo tiempo, este vibrador dual promete llevarte a cimas de placer antes inimaginables. ya sea que busques explorar tu propio cuerpo o añadir una chispa extra a tus momentos intimos en pareja, desiderium se adapta a todas tus necesidades, ofreciendo una experiencia profundamente satisfactoria y completamente personalizable.compra ahora y descubre por que desiderium es la eleccion perfecta para aquellos que no se conforman con menos que el extasis total. tu viaje hacia el placer absoluto comienza aqui.",Longitud: 200 mmDiámetro: 27–37 mmMotores: Doble motorizaciónPotencia: Vibración superintensaFunción de Calentamiento: Sí ,https://www.amantis.net/desiderium-el-arte-del-placer-dual/,False,False,False,True,False,True,True,False
4,PULSO AIR,vibrador palpitador con succionador,"estamos ante la revolucion del placer y en amantis tenemos todas las armas para hacerle frente. elige cual es tu batalla y tu arma, armate de valor y descubre como llevar la estimulacion sexual al siguiente nivel.vamos fuertes esta vez porque te traemos un juguete multifuncion. pulso air lo tiene todo, o casi. pulso air es un vibrador palpitador con succionador, es decir, es un juguete que no deja ni un hueco de tu vagina y vulva sin ser estimulado.tiene una forma curvada con dos extremos. uno de ellos sera el que introduciremos dentro de nuestra vagina y el otro el que dejaremos en la parte externa, es decir, posado sobre nuestra vulva.la parte que introduciremos tiene forma de dildo ahuevado. tiene estrias tanto en la punta como en los laterales. esto hara que la vibracion sea expansiva y tenga mas alcance en el impacto de las paredes de nuestro conducto vaginal. ademas, tiene un potente motor que vibra al son de 7 frecuencias diferentes. en la mitad de este dildo ahuevado encontraras un simbolo en forma de ovalo. esto sera tu perdicion: cuando actives la funcion veras que aparentemente no hace nada, pero si ejerces presion con el dedo notaras una suave palpitacion en su primera frecuencia. pero esto no queda asi, ya que la velocidad de la palpitacion ira aumentando hasta llegar a una fuerza que te llevara al extasis. este palpitador coincidira con la entrada de tu vagina, que es donde se encuentra la entrada de tu uretra, la fuente del conocido squirting, el liquido que corresponde a la eyaculacion femenina.esta parte del dildo es flexible pero la curva es rigida, por lo que, al introducirlo, automaticamente el succionador se posara sobre tu clitoris. este succionador emite ondas de sonido y podras elegir entre 9 combinaciones diferentes.este juguete en forma de uve tiene diez patrones de vibracion en el motor de la parte de estimulacion interna, siete velocidades en el simulador oral y diez frecuencias de beats en el palpitador.","Vibrador + palpitación + succionadorMedidas: 13 cm largo, 3 cm anchoMaterial: silicona + abs10 modos de vibración7 tipos de succión10 frecuencias de palpitaciónTipo de carga: mediante cable USB (incluido)Sumergible IPX7Color: morado, rosa y azul¿Cómo usar el vibrador PULSO AIR?Este juguete tiene tres botones:El de en medio con pulsación larga sirve para encenderlo.Con el botón que contiene una ilustración de unos labios activarás la succión.Con el botón de arriba las palpitaciones, y con el de en medio podrás cambiar la intensidad de la vibración.Podrás ajustar la zona del succionador a la zona donde se encuentre el clítoris fácilmente. Podrás activar la vibración, así como la succión y la palpitación por separado, y también todo a la vez. Te recomendamos que vayas poco a poco y dejes la estimulación clitoriana para el final. También podéis usarlo para masturbar un pene posándose en la esquina en donde las dos partes del juguete se unen. Otro uso será poner esa misma conjunción en nuestra garganta; notaremos dificultad al respirar y esto nos hará sentir el orgasmo de una manera mucho más profunda.Te recomendamos siempre usar uno de nuestros lubricantes a base de agua como Desliz! para favorecer la penetración y aumentar el placer.No olvides limpiarlo antes y después de usarlo con agua tibia y un jabón neutro, o un jabón bactericida como Limpín. Sécalo bien antes de guardarlo y mantenlo alejado de otros juguetes, por ejemplo en una de nuestras bolsas de satén. ",https://www.amantis.net/pulso-air-vibrador-palpitador-succionador/,False,False,False,True,False,True,True,False
5,BISOU,besos por ondas de succión con la mejor vibración,"en amantis tambien tenemos nuestros favoritos, y hemos de admitir que estas ante uno de los juguetes que mas acogida tienen entre la gente que nos visita. y no nos sorprende porque bisou lleva en abrazando vaginas mucho tiempo en amantis y todo el que le queda. ya se ha convertido en uno de nuestros clasicos, y como sabemos, los clasicos nunca mueren. bisou es un juguete muy completo, versatil y flexible. un estimulador por ondas, o succionador como mas comunmente se conoce, y un dildo ahuevado para introducir en nuestra vagina en el mismo juguete. si no sabes si decidirte entre la estimulacion interna o externa, ¿porque no tener las dos a la vez? este juguete tiene una forma suave y forma una curva que se adaptara a nuestra zona pelvica permitiendo una estimulacion doble tanto en nuestro clitoris como en nuestro punto g. recibiras besos tiernos y placenteros en tu clitoris asi como vibracion en tu interior. podras elegir entre 9 patrones de vibracion en la zona del dildo y acomodar su diseño estriado haciendo que su relieve coincida con la zona que a ti tanto gustito te da. el hecho de que podamos estimularnos por ambas zonas al mismo tiempo hara que tengamos un orgasmo interconectado y sera mucho mas intenso. los orgasmos intensos no solo nos interesan por el placer en si, que tambien, sino porque hacen que los beneficios de los mismos se potencien, asi pues tendremos la piel mas brillante, estaremos de mejor humor, disminuiremos el estres y favoreceremos el sueño.","Vibrador para punto G y movimiento de lengua para el clítoris independientesVibración: 9 modosRecargable (cable USB incluido)Sumergible IPX7Material: Silicona de grado médicoMedidas: 13.3 cm totales de largo / 9.3 cm totales de anchoDildo: 10.5 cm penetrables / 3.5 cm diámetro máximoBoquilla con lengua: 1.75cm de diámetroLengua: 9 modos¿Cómo se usa el vibrador con succionador BISOU?Puedes empezar utilizando la vibración para poder activar el circuito de placer, con la misma vibración podrás despertar al cuerpo y avisarle que se prepare para recibir placer.Antes de que tu clítoris esté preparado para recibir la succión, te sugerimos que lo estimules con la vibración, si vas directa al grano, quizás las sensaciones sean demasiado intensas. Cuando más excitadas estamos, menos sensible es nuestro clítoris y más deseoso está de recibir cualquier sensación que se presente.Para comenzar con la estimulación doble, te recomendamos que introoduzcas primero el dildo en tu vagina y luego acomodes la parte del clítoris. No todas tenemos el clítoris en el mismo sitio, así que tomate el tiempo que necesites para hacerlo coincidir.Ya sea porque has probado los succionadores de clítoris y quieres nuevas sensaciones, o porque te quieres lanzar a la piscina, has de saber que estas funciones son independientes. El dildo se dobla de manera que podremos usar solo la parte del succionador y combinarlo con una penetración en pareja.No olvides acompañarlo con tu lubricante base de agua preferido, como Desliz!, y limpiarlo antes y después de cada uso con agua tibia y un jabón neutro, o un jabón bactericida como Limpín. Sécalo bien antes de guardarlo y mantenlo alejado de otros juguetes, por ejemplo en una de nuestras bolsas de satén. ",https://www.amantis.net/bisou-besos-ondas-succion-la-mejor-vibracion/,False,False,False,True,False,True,True,False
6,KUCHI,minisuccionador sónico de amantis,"kuchi ¡pero que monada de succionador de clitoris! es tan mono que querras llevartelo a todas partes... ¡ah! espera... ¡que gracias a su tamaño compacto podras hacerlo! si te apetece usarlo mientras tienes penetracion no se interpondra entre tu y tu acompañante... y como es sumergible podras usarlo hasta en la bañera.tu nuevo compañero made in amantis tiene una boquilla de silicona blandita, y otra extra que cubrira mas espacio cuando lo apoyes contra ti, para que sea como sea tu cuerpo, kuchi pueda hacerte temblar.su boton unico de facil manejo y sus 9 modos de potente succion combinados con la suavisima vibracion de su motor lo hacen infalible contra esos ratos de aburrimiento.¿vas a dejarte deborar a besos?"," Succionador sónicoMaterial: silicona médica y ABSRecargable mediante imanes (cable de carga incluido). Tiempo de carga 1.5h, tiempo de uso continuado 1-1.5h Sumergible IPX7Silencioso <40 dbsMedidas: 10.2 de alto x 3.8cm de profundidad.Colores: Negro, púrpura o fucsiaLimpieza y conservación: Utiliza tu lubricante con base de agua favorito para cualquier tipo de juego sexual y obtener así la mejor experiencia. No olvides lavar siempre tus juguetes después de cada uso con un limpiador específico como nuestro spray limpiador Limpín. Te recomendamos mantener los juguetes separados entre sí en un lugar seguro y seco. Puedes utilizar nuestras bolsas de satén en tamaño pequeño. ",https://www.amantis.net/kuchi-minisuccionador-sonico-amantis/,False,False,False,True,False,False,True,False
7,FOXTAIL,plug anal cola de zorro de 35cm,"deja volar la imaginacion y saca tu lado mas salvaje con foxtail.este excitante plug anal diseñado para ayudarte en procesos de dilatacion es toda una fantasia. con el te sentiras una fiera poderosa capaz de someter a sus victimas, o simplemente luciras majestuosa tu belleza. y es que esta suave cola de piel sintetica de 35 cm es ideal para hacer volar la imaginacion, y te permitira excitarte a solas (imaginate frente a un espejo moviendo la cola y recibiendo todo el placer que te mereces) o en compañia (aqui poco hace falta decir, no creo que haya amante capaz de resistirse a una criatura como tu).su cuerpo de metal te permitira jugar con diferentes temperaturas, asi que prueba a meterlo en agua templada o a enfriarlo en la nevera y disfruta de las diferentes sensaciones.aplica unas gotas de tu lubricante anal favorito para disfrutar la experiencia y preparate para aullar de placer.",Tamaño plug S: 6.6cm Max Dia.: 2.8cmCola de pelo sintéticoLogitud cola: 35cmPeso 90gIncluye bolsita de satén para su conservación.Limpiar antes y después de cada uso con agua templada y jabón o con Limpín Bactericida ,https://www.amantis.net/foxtail-plug-anal-cola-zorro/,True,True,False,False,False,True,True,False
8,TANDEM 2 flex,vibrador doble flexible con mando,"tanto si ya eras fan de nuestro querido tandem como si no lo conocias, te presentamos su nueva version tandem 2 flex: mas flexible, reducido, recargable, con dos motores y mando a distancia. haz tu tandem ""chica->chica"" o ""chica->chico"" y prepatrate, tandem 2 flex lo tiene todo para dar mientras tomas, con un plus de comodidad y vibraciones!su nuevo diseño –mas compacto- lo hace mucho mas manejable, sin renunciar a la maxima calidad de su silicona suave y aterciopelada. tandem 2 flex lleva dos motores, uno para quien lo lleve puesto y otro en el dildo, que vibraran al ritmo de 10 patrones de vibracion diferentes y tres niveles de intensidad distintos, que puedes controlar desde el propio juguete o con… ¡un mando a distancia!decide si quieres utilizarlo sin arnes o en combinacion con un modelo abierto, como nuestro precioso arnes-braguita de amantis, que te aportara un extra de sujecion para no tener que preocuparte por nada. se adapta a cualquier cuerpo gracias a su flexibilidad y, si deseas darle mayor abertura, abrelo y cierralo con tus manos varias veces para aumentar su arco antes del primer uso.¿necesitas algun motivo mas para hacerte con el? pues aqui lo tienes… tandem 2 flex es salpicable, asi que podreis hacer realidad vuestras fantasias incluso en la ducha. ¿no es maravilloso? ¿nos hacemos un tandem?","10 patrones de vibración diferentes y tres niveles de intensidadMaterial: silicona y ABSLongitud operativa: 12 cm (dildo externo) / 8 cm (parte interna)Diámetro máximo: 3,4 cm (dildo externo) / 3,6 c, (parte interna)Sumergible IPX7 (no sumergir el mando)Batería de litio recargable (con cargador USB incluido)Tiempo de carga: 3 horasAutonomía: 1 hora (en uso) / 3 meses (en standby)El mando a distancia funciona con una pila CR2032 (incluida)Color: negro, rosa o púrpuraUsar con lubricante de base acuosa Limpiar correctamente antes y después de cada uso (con jabón neutro y/o bactericida tipo Límpín)Guardar en una bolsa de tela transpirable, alejado de la luz solar directa y de manera individual. Los juguetes sexuales no deben almacenarse nunca en contacto con otros. ",https://www.amantis.net/tandem-2-flex-vibrador-doble-flexible-mando/,False,False,True,True,False,True,True,False
9,AVATAR SMAUG,pene de dragón de silicona xl,"¿listos para una aventura epica en tu habitacion? llego el momento de descubrir el avatar smaug, el ultimo grito de nuestra coleccion avatar en amantis. ojo no es un juguete cualquiera; es una invitacion a explorar el lado mas salvaje y mistico del placer. olvidate de la monotonia y subete a una experiencia unica, donde la fantasia se encuentra con el goce mas intenso."," Clave del AVATAR SMAUG:Dimensiones Perfectas: Con 225 mm de largo y 50 mm de grosor, el AVATAR SMAUG es un poderoso dildo ideal para noches llenas de pasión y exploración. Ojo, su tamaño (también) impone.Silicona que Enamora: Suave, flexible y amigable con tu cuerpo. Hecho de silicona líquida de primera, el AVATAR SMAUG promete caricias llenas de placer y una comodidad inigualable.Ventosa para Juegos Diversos: ¿Te va el juego en solitario o prefieres la acción en pareja? Con su ventosa fuerte, el AVATAR SMAUG se pega a superficies lisas y se ajusta a tu arnés de confianza para experiencias manos libres o compartidas.Un Diseño que Incita: Dale un giro a tus encuentros con su diseño inspirado en los dragones más legendarios. Feroz en apariencia, pero gentil en el tacto, el AVATAR SMAUG está listo para llevarte a volar alto en el mundo del placer.Tip Pro: Para disfrutar al máximo de tu AVATAR SMAUG, no olvides el lubricante Desliz agua. Esta es la pareja perfecta para asegurar un viaje suave y extremadamente placentero.¿Por Qué AVATAR SMAUG? Porque la vida es demasiado corta para no aventurarse en el mundo del placer. El AVATAR SMAUG no solo te ofrece momentos de éxtasis; te invita a liberar tus fantasías más profundas. En Amantis, queremos que cada experiencia sea única, y con SMAUG, garantizamos un viaje sin retorno al corazón del deleite.Sé Parte del Mundo AVATAR de Amantis: La colección AVATAR es para los valientes, para aquellos que buscan más que placer; buscan historias, aventuras, sensaciones nuevas. Con el AVATAR SMAUG, estás a punto de embarcarte en la más apasionante de las travesías. ¿Te atreves?AVATAR SMAUG no es solo un encuentro, es una odisea de placer. Prepárate para desatar tus deseos más salvajes y sumérgete en la leyenda. ¡La aventura espera! ",https://www.amantis.net/avatar-smaug-dildo-de-fantasia-draconiana/,False,False,False,False,False,False,True,False
