ID,PRODUCT,SLOGAN,DESCRIPTION,CHARACTERISTICS,LISTA_URL,amenities,anal,BDSM,femenino,masculino,juguetes,lenceria,muebles
175,WARRIOR,suave casco vibrador para masaje integral,"una de las premisas principales de los guerreros espartanos era que, pasara lo que pasara, no te podias rendir en el campo de batalla… pues gracias a warrior, no solo no te rendiras antes de tiempo, sino que querras ir a la batalla una y otra vez sin parar.  para empezar, este nuevo masturbador tiene un diseño totalmente revolucionario. su forma de casco recubrira tu pene, y la sensacion sera mucho mas satisfactoria para tu soldado.la silicona que lo compone es muy suave, de calidad y tanto sus hojas laterales como el capuchon superior son muy flexibles, de modo que podras manipularlo y estimular tu pene como te plazca.sus 9 patrones de vibracion acompañados de un interior texturizado con puntos y estrias haran que tu y tu pene os estremezcais al compas, sobre todo cuando lo introduzcas por completo y descubras la sorpresa que guarda la visera para acariciarte la zona del glande y el frenillo.aplica una buena cantidad de lubricante a base de agua, dale tu lanza al warrior y disfruta al maximo cada contienda, seguro que no podras resistirte a repetir en mas de una ocasion."," Vibrador + instrucciones.Vibración: 9 programas.Sumergible IPX7 (se puede sumergir hasta 1 metro de profundidad durante 30 min)Recargable, con cable USB magnético incluido (Batería de iones de litio)Material: Silicona médica. Sin ftalatos. Sin látex.Medidas: 13,9 cm de longitud x 5,7cm de ancho (12cm de pene insertables).Color: Negro y Rojo.Recomendaciones: Utiliza tu lubricante con base de agua favorito para cualquier tipo de juego sexual y obtener así, la mejor experiencia. No olvides lavar siempre tus juguetes después de cada uso con un limpiador específico, como nuestro spray limpiador Limpín. Mantén tus juguetes separados entre sí, en un lugar seguro y seco. Puedes utilizar nuestras bolsas de satén en diferentes tamaños. ",https://www.amantis.net/warrior-suave-casco-vibrador-masaje-integral/,True,False,False,False,False,True,True,False
176,ROSSCO,anillo extra grueso de amantis,"a veces controlar la profundidad de la penetracion no es tarea facil y requiere de una concentracion casi casi inhumana... o lo era hasta que aparecio rossco.su suave y flexible cuerpo fabricado en tpe te permite dejarte llevar por el momento sin preocuparte por la profundidad de la penetracion, a la vez que te ayuda a controlar tu ereccion.sus dos relieves reversibles te dejaran escoger entre una sensacion teselada o triangular, ya sea mientras juegas con tu acompañante… o contigo, poque lubricando tu rossco con tu desliz! favorito podras utilizarlo como un masturbador.¿pinta bien? se siente mejor.",Donut o topeMaterial: TPEMedidas: 4cm de anchoCómo se utiliza el anillo-tope para pene ROSSCOPara utilizar esta anilla es recomendable esperar a tener una erección y para su fácil inserción es recomendable que utilices algún lubricante de agua como Desliz!Es importante que el anillo para pene se adecue al tamaño de tu pene para que haga su función correctamente y no apriete más de lo debido. ,https://www.amantis.net/rossco-el-donut-del-control/,False,False,False,False,False,False,True,False
177,SUAVIBRA,masajeador de pene con bala vibradora,"¿quieres una manga masturbadora blandita y esponjosa pero que tambien vibre? equilicua, aqui te traemos a tu masturbador para pene, un aliado que cumple con varias cosas que muchas personas con pene buscan y desean.suavibra es una manga masturbadora para pene de silicona medica blandita y ultra suave pero muy resistente. las paredes de este masturbador son mas estrechas a las que normalmente acostumbran las mangas masturbadoras clasicas para pene.al tener un agujero tambien mas pequeño la friccion sera mayor, ademas el cilindro donde introduciras tu pene esta lleno de pequeños relieves que bailaran con la piel que rodea el tronco de tu pene.ademas, suavibra tiene dos agujeros, uno por el que introduciras tu pene y ademas, otro en el que podras introducir una bala vibradora que transmitira toda la vibracion de manera indirecta a toda la manga. esta bala es una bala clasica con cargador de iman y nueve patrones de vibracion, tres intensidades y cuatro combinaciones vibratorias.la bala no viene insertada en el juguete, si no que es extraible, esto nos da muchisimas posibilidades de uso, desde usar la manga sin vibracion hasta que otra persona use la bala, o que la vibracion se traspase a otros genitales mientras le damos uso.","Medidas: 14,4cm x 8,9cm x 6,4cmMaterial: silicona + abs9 modos de vibraciónTipo de carga: mediante cable USB (incluido)Sumergible IPX7Color: Rojo y blancoComo se utiliza el masajeador de pene SUAVIBRASUAVIBRA es un estimulador de los genitales masculinos que podrás utilizar de diversas maneras, en solitario o en compañía.Si lo utilizas en pareja SUAVIBRA se convertirá en un amigo que podréis sacar a pasear de vez en cuando y funcionará como un potenciador del placer y dinamizador de las relaciones. Se nos ocurre que puedes combinarlo con una penetración anal o parahacer un jugoso petting de toda la vida, pero esta vez tu compi se gozará también la vibración. También, si lo usas en solitario, lo podrás combinar un masajeador prostático.Para colocarlo, te recomendamos que esperes a tener una erección, lubrica generosamente con algún lubricante de agua como Desliz! Te recomendamos que lo laves antes y después con nuestro jabón bactericida Limpín, lo seques bien y lo mantengas alejado de otros juguetes, por ejemplo en una de nuestras bolsas de satén. ",https://www.amantis.net/suavibra-masajeador-de-pene-con-bala-vibradora/,False,False,False,False,False,True,True,False
178,Mantente_Firme DONUT,kit de 3 anillas para el pene,"¿quieres probar un juguete sencillo, economico pero que cambie por completo tus relaciones? vale, pues sigue leyendo.los anillos para el pene mantente-firme donut son tan faciles de usar como satisfactorios. te sorprendera como tres sencillas anillas pueden cambiar tanto tu experiencia sexual. fabricadas en un material flexible, suave y respetuoso con tu cuerpo estas anillas haran que tengas erecciones mas duraderas y satisfactorias. no solo te permitiran disfrutar durante mas tiempo, si no que intensificaran notablemente tus sensaciones (¡y las de tu pareja!). juega a colocarte estas anillas donde mas te guste: en la base del pene, delante o detras de los testiculos, usa solo una, prueba con dos… sea como sea te aseguramos que le sentaran de fabula a tu pene, que lucira erecto, potente y seguro de si mismo durante mas tiempo. eso si, estos anillos no son como los del amor romantico ni te atan de por vida, asi que usalos tanto como quieras, pero no los uses de modo continuado durante mas de treinta minutos.tanto si lo usas a solas como en compañia, notaras al instante el efecto de estas sencillas pero maravillosas anillas. tu miembro ganara grosor, durara mas tiempo erecto y no tendras que preocuparte por esas perdidas de turgencia que a veces ocurren cuando nos despistamos. y es que claro, no es solo lo que se siente, tambien esta lo que se ve, y el placer de ver como tu miembro se yergue orgulloso, poderoso, capaz de cualquier cosa es francamente excitante.","Diámetro exterior 3,5cm, interior 1,7cm Material flexible Fabricado en TPR (material sin alergias y bueno con tu cuerpo) Kit de 3 colores transparente, azul y negro  ",https://www.amantis.net/mantente-firme-donut-kit-3-anillas-el-pene/,False,False,False,False,False,False,True,False
179,TRES FORT,kit de 3 anillas para el pene,"las anillas de estrangulacion son usadas desde hace decadas por razones esteticas y para lucir un miembro erecto mas lustroso, duro, potente y seguro de si mismo.   este kit se compone de 3 diferentes anillas de tamaños progresivos que podras configurar de diferentes maneras progresivas o en diferentes zonas de tu pene. las tres anillas estan fabricadas en un material flexible, suave y bueno con tu cuerpo, con ellas puestas te sentiras comodo. puedes anillarte la base del pene y sentiras una mayor concentracion sanguinea y temperatura en todo el tronco del pene, exactamente igual que si te haces un torniquete aumenta la presion en tu brazo y se muestran las venas mas claras. prueba a estrangular los testiculos para dar un caracter mas agresivo, recogerlos y para aumentar las sensaciones de control en el momento eyaculatorio. enlaza tu prepucio con la anilla mas pequeña y dale un aspecto de fisicoculturismo del amor a tu preciada herramienta. ¿quieres mantenerte mas firme y durante mas tiempo? hazte con este kit ya."," Diámetros 2.5, 3 y 3.5cmMaterial flexibleFabricado en TPR (material sin alergias y bueno con tu cuerpo)Disponible en color transparente, azul y negroCómo se utiliza las anillos para pene TRES FORTPara utilizar estas anillas es recomendable esperar a tener una erección y para su fácil inserción es recomendable que utilices algún lubricante de agua como Desliz! Es importante que la anilla se adecue al tamaño de tu pene para que haga su función correctamente y no apriete más de lo debido.¿Cómo saber si es un tamaño adecuado para mí?Calcula el diámetro de tu pene o del conjunto de tu pene y testículos.Réstale 3 mm para que la anilla quede prieta. La anilla debe presionar pero ¡no apretarte hasta el desmayo! Asegura que una vez colocada te cabe un dedo estirando la goma.Colócala con el pene semierecto y lubricanteÚsala máximo 20-25 minutos y no te quedes dormido con ella. ",https://www.amantis.net/tres-fort-kit-3-anillas-el-pene/,False,False,False,False,False,False,True,False
180,SEVEN,fundas elásticas para el pene,"porque a ti te daban 2, y 3 y 4... ¡ahora quieres 7! ¿por que comprarte solo un juguetito? ¿por que quedarte con una sola funda de pene cuando puedes tener... 7? ¡si, 7! este kit de fundas elasticas para el pene augura erecciones, placer y diversion para cada dia de la semana.el lunes, puedes empezar con la funda de puntos. daras placer a picos a quien se deje penetrar; el martes, coges la cubierta de pezoncillos. resonaran sonrisas y cosquillitas en los recovecos de vuestros cuerpos; miercoles, combinais, y os quedais con la funda que combina puntos y pezones para recordar lo bien que os lo pasasteis al empezar la semana; y el jueves... ¡envoltura de triangulos! ¿celebrais que una funda ha entrado en vuestra vida?; viernes, ¡puntazo! llega la funda gruesa de puntos para los que necesitan emociones mas fuertes; y sabado... ¡todos juegan, pelillos y estrias por doquier!; y llego el domingo, santo dia, requiere para la ocasion que te enfundes la goma mas grande, la de los puntos mas ominosos, la que pretende hacerte recordar porque una funda vale un imperio. si es que llegas a domingo, claro...y si eres un begginner, no dejes de leer. quizas te estes preguntando: ¿para que me va a servir a mi una funda para el pene? pues se todo oidos, mister, porque si aun no lo probaste decirte que una funda vigoriza y lustra el pene y puede ayudarte a controlar tu eyaculacion y ademas, da a tu partner sensaciones y texturas antes impensables... como la moda, hombres y mujeres venimos al mundo guapxs y hermosxs, pero bien arregladitos, ¡somos preciosxs!","Colores: Negro, Transparente y Azul Limpieza: limpia el juguete antes y después de su uso con Limpín. O en su defecto, con agua tibia y jabón neutro.Material: TPR super flexibleMedida: diámetro regulable.Nota: Suspende el uso si notas cualquier molestia. ",https://www.amantis.net/seven-fundas-elasticas-el-pene/,False,False,False,True,True,False,True,False
181,TOK VOLO,anilla vibradora con mando a distancia y 10 programas,"los chicos nos los pediais desde hace tiempo y por fin os podemos ofrecer la version masculina con anilla incluida de nuestro super ventas tok2. esta fantastica anilla vibradora es inalambrica, muy potente, sumergible y dispone de 10 programas de vibracion que podras o podran cambiar desde un mando a distancia accionado hasta a 8 metros del objetivo.la anilla es flexible pero se ajusta con fuerza a la base del pene. esa presion te ayudara a tener una ereccion mas duradera y un mayor control sobre tu eyaculacion ademas de conseguir explosiones mucho mas potentes, profundas, abundantes. ademas, durante la penetracion, estimularas el clitoris o el perineo de tu pareja con las maravillosas pequeñas protuberancias situadas estrategicamente en la base y parte superior y cambiando facilmente de programa de vibracion con el mando. ademas, podras jugar en una cantidad de sitios donde usarla la convertiran en un arma perversa que te hara disfrutar de lo lindo en cualquier cena, boda o reunion y sentir su vibracion incontrolable en la base de tu pene y perineo. y si a tu chica le da envidia ver como te lo pasas, podras retirar la anilla y dejarle jugar un ratito.a ver, valiente, ¿te atreves a darle el mando a alguien?","  · Silencioso · Anilla elástica, ideal para cualquier diámetro o tamaño de pene. · Dimensiones bala: largo 6.5Cm, ancho 2Cm. · Diámetro de la anilla interior: 2 cm en reposo y hasta 6 cm estirada. · Sumergible. (ojo el mando no) · Incluye, la anilla, la bala vibrador con mando y 2 juegos de pilas (LR44) · 10 programas de vibración (3 niveles de intensidad + 7 programas) · Bala fabricada en ABS y anilla en TPR (100% compatible y muy bueno con el cuerpo) · Alcanza 8 metros de distancia. · Disponible en color negro. · Te recomendamos que antes de su uso aprietes bien la tapa de la bala y que al terminar su uso vuelvas a poner el plástico separador blanco para evitar que se gasten las pilas de tu VOLO.Cómo usar el vibrador para parejas TOK VOLOTOK VOLO es un juguete para parejas que dinamizará tus relaciones, aumentará el placer y potenciará las sensaciones. Una vez tengas una erección, lubrica generosamente con algún lubricante de agua como Desliz!.Comienza colocando la primera anilla por detrás de los testículos, la siguiente quedará situada en la base del pene. Si eres de los que quieres más, puedes probar a mezclarlo con una sensación de calor con nuestro Desliz! efecto calor.Podréis probar a hacer todas las posturas normales pero con una estimulación nueva sinecesidad de usar las manos. Te recomendamos que lo laves antes y después con nuestro jabón bactericida Limpín, lo seques bien y lo mantengas alejado de otros juguetes, por ejemplo en una de nuestras bolsas de satén. ",https://www.amantis.net/tok-volo-anilla-vibradora-mando-distancia-10-programas/,False,False,False,True,True,False,True,False
182,SAN BERNARDA,el arnés sexual esbelto y de tiro alto,"¿te gustaria ser una perra que elige su propio arnes? en amantis te animamos a ser todo lo perra que tu quieras. pero una de esas perras que puede elegir el arnes que quiere ponerse. por eso no paramos de ampliar la coleccion y traer nuevos modelos en donde todas podais elegir el que mejor va con vosotras. el arnes san bernarda es un arnes de polipiel, es decir un fiel imitador al cuero pero sin sufrimiento animal, para aquellas que gozan de todo lo que suscita la apariencia de este material asi como su contacto con la piel. el arnes san bernarda tiene un diseño triangular con una anilla de metal que coincide con el vertice inferior, y a su vez con tu bonito monte de venus. de esta anilla de metal sale otra tira ajustable que se unira en el medio de la tira que sujeta las lumbares siguiendo la linea que separa nuestros gluteos, es decir, como si fuera un tanga de toda la vida. la anilla metalica tiene un tamaño estandar que la hace compatible con la gran mayoria de tamaños de dildos, siempre que cuenten con base o ventosa. ¿ya sabes con que tipo de dildos puedes empezar a ladrar? conoce nuestra coleccion de dildos realisticos avatar , nuestros glups! o lizo.",Composición: 100% Poliéster Talla: ÚnicaColor: Negro y rojoLimpieza y conservación: Lavar con agua fría y utilizando productos de limpieza suaves o específicosDildo no incluido ,https://www.amantis.net/san-bernarda-arnes-sexual-tiro-alto/,False,False,True,True,False,True,True,False
183,Arnés Panty_Slip,todoterreno para dildos y packers en comodidad,"no podras dejar de tocar este arnes, y es que su mezcla de algodon y elastano hacen que simule a la perfeccion cualquiera de nuestras prendas interiores.con forma de braguita o slip, segun se mire, sus tiras se deslizan bajo las nalgas lo que ademas de sostenerlas y elevarlas, las señala como punto erotico visual high-level....para penetraciones simples, dobles y con bolsillo interno para acomodar una bala vibradora o para usarlo como packer. cualquiera de las opciones encajan a la perfeccion con este suave arnes todo terreno, y como tal, lavable en lavadora.se ofrece en 3 tallas: xs/s-m/l-l/xlsuave y comodo...facil de vestir, de colocar los dildos o packers y de lavar… que hoy en dia, ¡ eso es lo que cuenta! hazme la vida algo mas facil y te entregare mis mas profundos deseos…¿o no?","Tejido: algodón, Elastano, Poliéster y Nylon.color : negro3 tallas a elegir: XS/S M/L XL/XXL ",https://www.amantis.net/arnes-panty-slip-todo-terreno-comodidad-sujecion/,False,False,True,True,False,True,True,False
184,Pene hueco con arnés de Fetish Fantasy,,"¿alguna vez has querido sentirte mas seguro y reforzar el tamaño de tu pene y disfrutar del sexo con tu pareja hasta alcanzar juntos el orgasmo? ahora puedes tener el ancho y largo que siempre soñaste con el nuevo pene hueco con arnes de la serie fetish fantasy. su arnes elastico se ajusta facilmente a cualquier cintura, mientras que el dildo es suave de tacto pero rigido y eternamente erecto. es perfecto para hombres con disfuncion erectil, problemas de eyaculacion precoz o que simplemente buscan añadir algo de grosor y tamaño extra a su miembro. el dildo esta fabricado en un material libre de falatos y compatible con la mayoria de lubricantes de agua y silicona. limpiar despues de usar con limpin y agua tibia.",· Longitud total: 18.9 cm (17.8 cm insertables)· Diámetro: 4.3 cm· Longitud de la parte interior 10.4 cm· Diámetro de la parte interior: 4.3 cm· Tamaño cintura 132.1 cm· Incluye antifaz de regalo  ,https://www.amantis.net/pene-hueco-arnes-fetish-fantasy/,False,False,True,True,True,True,True,False
185,Arnés sexual DUCHESS,clasista por naturaleza.,"duchess es el arnes universal y ajustable que te permitira tomar las riendas del juego sexual. coloca el dildo que desees a traves de la anilla metalica superior y disfruta, a la vez que haces disfrutar a tu pareja, de unas embestidas inolvidables. ademas, el sistema de doble anilla esta diseñado para permitir la doble penetracion. introduce tu miembro en la anilla inferior y vuestro dildo favorito en la superior. dile a tu chica que se agarre, porque vienen curvas y, ala… ¡a disfrutar! recuerda que su diseño tambien te permite cambiar las dos anillas por una unica (no incluida) si es que prefieres utilizarlo de esta forma.fabricado en un material suave y comodo que imita la piel pero que ¡no contiene ningun trazo animal! asi que, veganxs: ¡este es vuestro nuevo mejor amigo! disfruta de la elegancia y sofisticacion de la piel vegana. ajusta las correas sobre tus muslos y fundete con el arnes “the duchess”, tan agradable y sensual que no querras quitartelo... recomendaciones de limpieza y conservacion: la limpieza de este tipo de productos es muy sencilla, tan solo has de pasarle un paño humedo a las correas y anillas y dejarlo secar al aire. si lo prefieres, tambien puedes utilizar las toallitas desechables pjur que evita la fijacion de olores corporales en tus juguetes y desinfecta para dar larga vida a los aliados de tu placer.","El envase contiene: arnés universal y ajustable + 2 anillas metálicas con broches de velcro· Medidas: arnés ajustable hasta 162.5cm de cintura y anillas: 5cm diámetro (grande) + 3.75cm diámetro (pequeña) · Peso: 260 gr· Material: Poliuretano, poliéster y libre de níquel · Resistencia al agua: 100% resistente al agua· Tipo de uso: penetración única (dildo) o doble (dildo + pene) · Para él/ella: sí (unisex) · Color: Negro ",https://www.amantis.net/arnes-sexual-duchess-clasista-naturaleza/,False,False,True,True,False,True,True,False
187,PULSO WET,vibrador palpitador con lengüita,"estamos ante la revolucion del placer y en amantis tenemos todas las armas para hacerle frente. elige cual es tu batalla y tu arma, armate de valor y descubre como llevar la estimulacion sexual al siguiente nivel.vamos fuertes esta vez porque te traemos un juguete multifuncion, pulso wet lo tiene todo o casi. pulso wet es un vibrador palpitador con lengua, es decir, es un juguete que no deja ni un hueco de tu vagina y vulva sin ser estimulado. tiene una forma curvada con dos extremos, uno de ellos sera el que introduciremos dentro de nuestra vagina y el otro el que dejaremos en la parte externa, es decir, posado sobre nuestra vulva.la parte que introduciremos tiene forma de dildo ahuevado. tiene estrias tanto en la punta como en los laterales. esto hara que la vibracion sea expansiva y tenga mas alcance en el impacto de las paredes de nuestro conducto vaginal. ademas tiene un potente motor que vibra al son de 7 frecuencias diferentes. en la mitad de este dildo ahuevado encontraras un simbolo en forma de ovalo, esto sera tu perdicion, cuando actives la funcion veras que aparentemente no hace nada, pero si ejercemos presion con el dedo notaras una suave palpitacion en su primera frecuencia. pero esto no queda asi, la velocidad de la palpitacion ira aumentando hasta llegar a una fuerza que nos llevara al extasis. este palpitador coincidira con la entrada de tu vagina que es donde se encuentra la entrada de tu uretra, la fuente del conocido squirting, el liquido que corresponde a la eyaculacion femenina.esta parte del dildo es flexible pero la curva es rigida por lo que al introducirlo, automaticamente, el simulador oral se posara sobre tu clitoris. esta lengüita es pequeña y fina, es decir que focalizara mucho nuestro pequeño eje central del placer, el clitoris. esta lengua se mueve de arriba hacia abajo y esta rodeada por suaves y finas paredes completamente flexibles de silicona liquida que permitiran hundir el juguete tanto como quieras. este juguete en forma de uve tiene diez patrones de vibracion en el motor de la parte de estimulacion interna, siete velocidades en el simulador oral y diez frecuencias de beats en el palpitador.","Vibrador + palpitación + lengüita automáticaMaterial: silicona + abs10 modos de vibración7 tipos de beso con lengua10 frecuencias de palpitaciónTipo de carga: mediante cable USB (incluido)Sumergible IPX7Color: fucsia¿Cómo usar el vibrador palpitador con lengüita PULSO WET?Este juguete tiene tres botones. El de en medio con pulsación larga sirve para encenderlo, con el botón de que tiene una ilustración de unos labios activarás el simulador oral, con el de arriba las palpitaciones y con el de en medio podrás cambiar la intensidad de la vibración.Podrás ajustar la lengua a la zona dónde se encuentre el clítoris fácilmente. Podrás activar la vibración así como el movimiento de la lengua y la palpitación por separado y también todo a la vez. Te recomendamos que vayas poco a poco y dejes la estimulación clitoriana para el final. También podéis usarlo para masturbar un pene posándose en la esquina en donde las dos partes del juguete se unen. Otro uso será poner esa misma conjunción en nuestra garganta, notaremos la dificultad al respirar y esto nos hará sentir el orgasmo de una manera mucho más profunda.Te recomendamos siempre usar uno de nuestros lubricantes a base de agua como Desliz! para favorecer la penetración y aumentar el placer.No olvides limpiar antes y después de usarlo con agua tibia y un jabón neutro, o un jabón bactericida como Limpín. Sécalo bien antes de guardarlo y mantenlo alejado de otros juguetes, por ejemplo en una de nuestras bolsas de satén. ",https://www.amantis.net/pulso-wet-vibrador-palpitador-lenguita/,False,False,False,True,False,True,True,False
