ID,PRODUCT,SLOGAN,DESCRIPTION,CHARACTERISTICS,LISTA_URL,amenities,anal,BDSM,femenino,masculino,juguetes,lenceria,muebles
116,MAMBA,funda extensora del pene,"la funda realista mamba con anilla de sujecion de 16 cm es justo lo que estabas buscando para disfrutar de nuevas y profundas sensaciones. aumenta tu pene un 30% a lo largo y ancho de su ser y dotale de ese toque original que despertara todas tus fantasias.se adapta a todos los tamaños de pene, y la suavidad y elasticidad del material te permitira disfrutar de una penetracion mas intensa, e incluso olvidarte de que la llevas puesta.coloca la anilla alrededor de tus testiculos para que la funda quede bien sujeta y te ayude a retrasar la eyaculacion. introduce tu pene en ella sin miedo y entregate al inmenso placer que te produciran las bolitas estimuladoras colocadas estrategicamente en el interior de esta funda.aplica siempre una cantidad generosa de lubricante a base de agua para facilitar la penetracion. y ahora si, ya puedes embestir a tu pareja con todo tu power y ¡disfrutar de un look distinto para tu pene!",Funda extensora realista con relieves de estimulación en su interior.Dimensiones: largo 16 cm / 5 cm- 5.5 cm de diámetro en su parte más ancha.Fabricado en TPE libre de ftalatos.Color: Negro o piel clara.Limpiar correctamente antes y después de cada uso (con jabón neutro y/o bactericida tipo Límpín).Guardar alejado de la luz solar directa y de manera individual. Los juguetes sexuales no deben almacenarse nunca en contacto con otros. ,https://www.amantis.net/mamba-funda-extensora-del-pene/,True,False,False,False,False,False,True,False
117,AUGMENTINE,funda extensora para pene transparente,"el tamaño no importa, aporta. y esta funda para pene consigue aportarte varias cosas importantes: una textura de relieve con pinchos que tu pareja sexual adorara; una anilla para tus testiculos; mas grosor en la penetracion y 2,5 cm de largaria adicionales.atrevete a experimentar un nuevo placer con la penetracion gracias a augmentine, porque esta funda ofrece sensaciones totalmente nuevas tanto para quien la lleva como para quien la recibe. ademas, gracias a su textura suave y flexible, es muy facil de colocar y queda mejor sujeta gracias a la anilla.¿quien dijo que la penetracion podria resultar monotona?","Funda extensora con relieve de pinchosTacto suave y flexibleDimensiones: largo 14,5 cm (capacidad interior 12 cm) 4,9 cm diámetro máximo / Anilla testículos flexible: 3cm diámetro interiorFabricado en TPE libre de ftalatosColor: transparenteLimpiar correctamente antes y después de cada uso (con jabón neutro y/o antibactericida tipo Límpín)Guardar alejado de la luz solar directa y de manera individual. Los juguetes sexuales no deben almacenarse nunca en contacto con otros.Cómo se utiliza la funda para pene SPIRITPara utilizar esta funda es recomendable esperar a tener una erección y para su fácil inserción es recomendable que utilices algún lubricante de agua como Desliz! Una vez puesta aunque perdamos la erección la funda puede quedarse puesta y darnos otro tipo de juegos y/o roces.Es importante que la funda no apriete más de lo debido, si es así te recomendamos que busques fundas que se adecuen al tamaño de tu pene. Aún así no es recomendable que la tengas puesta más de 20-30 minutos ni que te quedes dormido con ella puesta.Te recomendamos que la limpies antes y después de cada uso con jabón neutro y/o bactericida tipo Limpin. Guárdalo de manera individual alejado de la luz solar directa.Los juguetes sexuales no deben almacenarse nunca en contacto con otros. Se recomienda un uso moderado. ",https://www.amantis.net/augmentine-funda-extensora-pene-transparente/,False,False,False,False,False,False,True,False
118,TWERK,anillo versátil para pene,"en amantis, nos especializamos en ofrecer accesorios innovadores para enriquecer tu vida sexual, haciendola mas divertida, consciente y placentera. el anillo para pene twerk es un ejemplo perfecto de nuestra dedicacion a la calidad y versatilidad.funcionalidades y flexibilidad: twerk se distingue por su adaptabilidad. fabricado con materiales flexibles y maleables, este anillo se ajusta comodamente, garantizando una experiencia personalizada. sus diferentes posiciones permiten funciones variadas, desde intensificar la sensibilidad hasta prolongar la duracion de tu sesion sexual.diseño y tamaño: este anillo transparente y discreto tiene un diametro de 4.5 cm. su resistencia es notable, con un grosor superior al promedio, asegurando durabilidad y eficacia.posicionamiento y beneficios:retraso de la eyaculacion: colocando el anillo sobre los testiculos, potencia la sensibilidad en esta zona, retrasando la eyaculacion.aumento de sensibilidad: al colocarlo en el glande, se intensifica la sensibilidad. mantenimiento de la ereccion: ideal para casos en los que quieras lucir un pene mas fuerte, colocandolo en la base del pene ayuda a mantener la ereccion por presion sanguinea.engrosamiento del pene: colocandolo en el tronco del pene, se consigue un efecto de mayor grosor y lozania."," del Anillo para Pene TWERK:Material: TPE de alta calidad, libre de ftalatos.Diámetro: 4,5 cm.Resistencia al agua: Totalmente sumergible.Rango de Rigidez: Ajustable a diferentes necesidades.Instrucciones de Uso:Te recomendamos el uso de lubricantes a base de agua, como 'Desliz!', para una inserción más cómoda.Colocar con el pene semierecto y con lubricante.No exceder 20-25 minutos de uso continuo.Evitar dormirse con el anillo puesto.Consejos para Elegir el Tamaño Adecuado:Mide el diámetro de tu pene o del conjunto pene-testículos.Resta 3 mm al diámetro medido para asegurar un ajuste óptimo.Verifica que puedas pasar un dedo estirando la goma una vez colocada.Con TWERK, descubre una nueva dimensión de placer y control, diseñado específicamente para adaptarse a tus necesidades y deseos. Ver características y medidasAnillas para peneDiferente rango de rigidezMaterial: TPESin ftalatosDiámetro: 4,5 cmSumergibleCómo se utiliza el anillo para pene TWERKPara utilizar esta anilla de placer es recomendable esperar a tener una erección y para su fácil inserción es recomendable que utilices algún lubricante de agua como Desliz!Es importante que la anilla se adecue al tamaño de tu pene para que haga su función correctamente y no apriete más de lo debido.¿Cómo saber si es un tamaño adecuado para mí?Calcula el diámetro de tu pene o del conjunto de tu pene y testículos.Réstale 3 mm para que la anilla quede prieta. La anilla debe presionar pero ¡no apretarte hasta el desmayo! Asegura que una vez colocada te cabe un dedo estirando la goma.Colócala con el pene semierecto y lubricanteÚsala máximo 20-25 minutos y no te quedes dormido con ella. ",https://www.amantis.net/twerk-anillo-versatil-para-pene/,False,False,False,False,False,False,True,False
119,MAGNETIC,doble anilla con vibrador para clítoris o testículos,"queremos traer ese magnetismo que os unira durante el coito y potenciara vuestras sensaciones hasta el infinito. magnetic es una doble anilla con una bala vibradora estriada incorporada. esta bala vibradora tiene 9 patrones de potente vibracion, que al estar unida a la doble anilla, su vibracion sera transmitida a la anilla y a su vez a lo largo del tronco del pene. la anilla tiene doble funcion; una es para la base del pene, haciendo que se potencie y alargue la ereccion, y la otra es para colocarla en la parte superior de los testiculos para retrasar la eyaculacion, haciendo que tengas mayor control sobre tu cuerpo. magnetic tiene diferentes usos pero solo un boton. muchas de nuestras partes erogenas podran ser estimuladas. durante el coito y con penetracion profunda estimulara el clitoris; al ritmo de juegos de entrada y salida, toda la parte externa a lo largo de la vulva con movimientos mas dinamicos. ademas, si a magnetic le damos la vuelta, los testiculos podran ser estimulados sintiendo esas cosquillas que la vibracion les proporcionara. fabricada 100% de silicona medica, es recargable (incluye cargador usb) y podras elegir en dos colores: negro y verde. tiene dos años de garantia y es resistente a salpicaduras.","Doble anilla para pene con bala vibradora incorporada.Material: silicona (tacto aterciopelado) y ABS (acrilonitrilo butadieno estireno).Medidas: 4.7 cm estimulador (3.9 cm diámetro interno anilla pene (elástica) / 4.1 cm anilla testículos (elástica).Vibración: 9 modos.Recargable (cable USB incluido).Sumergible.Color: negro o verde azulado.Totalmente silencioso.Cómo usar el vibrador para parejas MAGNETICMAGNETIC es un juguete para parejas que dinamizará tus relaciones, aumentará el placer y potenciará las sensaciones. Una vez tengas una erección, lubrica generosamente con algún lubricante de agua como Desliz!. Comienza colocando la primera anilla por detrás de los testículos, la siguiente quedará situada en la base del pene. Si eres de los que quieren más, puedes probar a mezclarlo con una sensación de calor con nuestro Desliz! efecto calor.Podréis probar a hacer todas las posturas normales, pero con una estimulación nueva sin necesidad de usar las manos. Te recomendamos que lo laves antes y después con nuestro jabón bactericida Limpín, lo seques bien y lo mantengas alejado de otros juguetes, por ejemplo en una de nuestras bolsas de satén. ",https://www.amantis.net/magnetic-doble-anilla-vibrador-clitoris-o-testiculos/,False,False,False,True,False,False,True,False
121,Arnés sexual VLAST,super fijación y estética fetish,"vas a una fiesta fetish y tu arnes para dildo no le pega ni con cola a tu atuendo de domina. ¿a quien no le ha pasado alguna vez? con este arnes tienes un 2en1 ideal, tanto si vas a tu local preferido como si te montas la fiesta en casa… sensualidad, poder y practicidad en una sola pieza. porque te sirve tanto de outfit fetish como para acoplar tu dildo preferido y convertirte en la reina de la noche.de tacto aterciopelado por dentro y de cuero sintetico por fuera. aqui la unica animal vas a ser tu. su diseño es de todo menos obvio y previsible. ¡fijate como luce por detras e imagina como van a seguirte con la mirada a tu paso! ademas, por si no fuera poco, es un arnes super comodo de llevar y ajustable a una gran variedad de cuerpos.¿sabes ya que dildo ponerte para la ocasion? por si te ayuda, te sugerimos nuestro maravilloso avatar ewok u otros modelos compatibles con arneses de anillas. ¡y acuerdate de añadirle siempre un poquito de lubricante!¿lista para no dejar a nadie indiferente?"," Arnés de cuero sintético 100% veganoNegro con anillas y tachuelas plateadasTalla única ajustable: 105 cm máximo cintura / 106 cm máximo caderas / 54.5 cm máximo ingle / 4 cm diámetro anilla para dildo Suave al tactoNo lavar en la lavadora. En caso de lavado, se recomienda hacerlo con un paño húmedo, a mano.No plancharDildo no incluidoAVISO: comprueba que este complemento se adapta a tus medidas antes de adquirirlo ",https://www.amantis.net/arnes-sexual-vlast-super-fijacion-estetica-fetish/,False,False,True,True,False,True,True,False
122,MARATON MAN,arnés con dildo hueco de silicona de amantis,"por fin un pene hueco con arnes para poder prolongar tus sesiones amatorias hasta los 42 kilometros o mas alla. maraton man es un revolucionario artilugio sexual para ayudarte a mejorar tu marca, sea cual sea.son muchos los hombres que no consiguen una ereccion duradera, pero que quieren seguir participando activamente de sus relaciones sexuales con sus parejas y disfrutar de los momentos de intimidad y goce sin complicaciones, cirugias o pocimas milagrosas.en amantis llevabamos años ofreciendo soluciones a medias a todas esas personas, algunas eran muy grandes, otras eran muy rigidos, otras de materiales de mala calidad. pero, por fin tenemos una joya en nuestras tiendas y queremos compartirla contigo. bienvenido maraton man, te estabamos esperando desde hace tiempo.maraton man esta pensado para todos aquellos hombres deseosos de dar placer, sin tregua y sin pausa a sus amantes. dildos huecos en dos tamaños: mediano (13cm) y grande (16cm), diseñados en una suave y flexible silicona que te hara olvidar cualquier dildo hueco que hayas probado con anterioridad.este arnes tiene importantes detalles a destacar:dildo hueco, suave y flexible, con capacidad para alojar un pene con poca o ninguna ereccion.primeros 6 cm en el modelo grande, y primeros 4 cm en el mediano, partiendo desde el glande, son rigidos para facilitar los juegos de penetracion.base para la pelvis amplia, suave y flexible siendo esta una prolongacion del mismo dildo, diseño que ajusta este accesorio en perfecta sintonia con nuestra anatomia. es mas comodo y facil de usar. ademas, incorpora una prolongacion hueca inferior para acomodar los testiculos. de este modo el dildo estara perfectamente ajustado a tu cuerpo, fisica y visualmente.el arnes es una tira elastica que se ajusta a cualquier talla y desmontable. si, si, puedes quitarla para lo que quieras.estamos muy felices de participar en esta carrera. maraton man es un perfecto y claro ganador, sin tongos que valgan. ¡aplausos y eurekas!si deseas una experiencia mas intensa echa un visazo a maraton man intense con vibracion.","Material: dildo de silicona / cintura goma elásticaMedidas:Tamaño mediano 13 cm x 3 cm (Cavidad interior 9 cm x 2.5 cm)Tamaño grande 16cm x 4 cm (Cavidad interior 13 cm x 3.5 cm)SumergibleDesmontableTamaño de cintura adaptable desde 66 cm hasta 125 cmLimpieza y conservación: Limpialo antes y después de cada uso con agua tibia y jabón neutro, o un jabón bactericida como Limpín. Guarda tus juguetes alejados de la luz solar directa y de manera individual (no deben almacenarse nunca en contacto con otros) por ejemplo con nuestras bolsas de satén.No olvides acompañarlo con tu lubricante a base de agua preferido, como Desliz! Agua,  ",https://www.amantis.net/maraton-man-arnes-dildo-hueco-silicona-amantis/,False,False,True,True,True,True,True,False
123,SAMOYEDA,lujurioso arnés con volantes,"¿pasear a lo perri por el interior de otros cuerpos con bonitos volantes que decoren tus contornos? para las mas coquetas, traemos el arnes samoyeda, ese arnes que no solo tiene volantes de adorno, si no que hara que tu gires el volante en la direccion que quieras. que te atrevas a ser una perra que elige el camino que quiere tomar. el arnes samoyeda tiene una potente base triangular de polipiel, imitador del cuero (100% vegano) embellecido con un entrelazado que nos hara recordar a una bonita braguita lencera. pero este arnes no solo se preocupa por la estetica, si no que gracias a un acabado levemente acolchado en la parte interior, podras moverte libremente y de forma flexible sin ninguna molestia. las tiras, muy sencillas de ajustar, han sido diseñadas para que queden por debajo de los gluteos, dejando toda tu parte trasera libre de ataduras, lista para que te agarren y aprieten mientras tu transitas la perra salvaje que llevas dentro.   cuenta con una anilla metalica que tiene un tamaño estandar haciendola compatible con la gran mayoria de tamaños de dildos, siempre que cuenten con base o ventosa. esta anilla es intercambiable, es decir, que gracias a los botones la puedes quitar y cambiar por otra de otro material o tamaño que se ajuste al dildo que apetezca disfrutar en cada momento. ¿ya sabes con que tipo de dildos quieres empezar a ladrar? conoce nuestra coleccion de dildos realisticos de dildos avatar o nuestros glups! o lizo.",Composición: 100% Poliéster y algodónTalla: ÚnicaColor: Negro y rojoLimpieza y conservación: Lavar con agua fría y utilizando productos de limpieza suaves o específicosDildo no incluido ,https://www.amantis.net/samoyeda-lujurioso-arnes-volantes/,False,False,True,True,False,True,True,False
126,PASIFLORA Vibrador Punto G con bracitos masajeadores,,"la pasiflora es la flor de la pasion, y pasion es lo que sentiras solo de ver como se mueve este peculiar juguete que guarda un ligero parecido con esta flor tan marciana.¿eres de las personas que les excita escuchar las palabras improvisacion y experimentacion? pues con pasiflora, no solo experimentaras pasion, si no que ademas tendras infinitas posibilidades de experimentar diferentes sensaciones gracias a lo que ofrece.pasiflora es un suave y elegante vibrador punto g de doble estimulacion. por un lado, encontramos un dildo con forma ahuevada y una punta estriada y por el otro un masajeador de zonas erogenas.la super novedad de pasiflora es sus bracitos masajeadores; no solo vibran si no que ademas se mueven girando sobre si mismos de una forma muy sorprendente y gustosa. podremos jugar y alternar con 9 programas diferentes que combinan la disminucion de la velocidad de movimiento giratorio, la intensidad de la vibracion asi como las combinaciones ritmicas. estos bracitos se mueven independientemente y acariciran de una manera muy especial zonas del cuerpo que puedan contener y abrazar por su forma como el clitoris, los pezones y el glande.la parte con forma falica esta recubierta con unas maravillosas estrias que haran que tu conducto vaginal sea masajeado, favoreciendo la conciencia del mismo. la parte de este vibrador con la que nos estimulamos interiormente nos ofrece tres intensidades y cinco combinaciones vibratorias, asi como una curvatura y rigidez, lo cual nos dara mayor margen de manejabilidad. al ser un juguete de doble uso, sera un candidato ideal para compartir en pareja, ¡que vuele la imaginacion!","Vibrador doble estimulación5 modos de vibración + 3 velocidades 9 combinaciones de bracitos giratoriosRecargable 5V (cable USB incluido)Material: silicona + absSalpicable IPX6Color: moradoSilencioso <50dbCómo se utiliza el vibrador punto G PASIFLORAPASIFLORA es un gran juguete pues congenia bien con la idea de activar poco a poco el circuito de la excitación; y esto es gracias a sus bracitos masajeadores. Recuerda que si vamos directamente al lío solo tendremos una respuesta meramente fisiológica y la cosa no tiene tanta gracia.PASIFLORA tiene dos botones, el de arriba maneja los bracitos y el de abajo activa la vibración del dildo. Para encenderlo, has de pulsar tres segundos y luego toques simples para cambiar de programa, aumentar o disminuir la vibración. Este juguete tiene dos motores, por lo que podrás activarlos de manera simultánea o alterna.Lo ideal es que empieces con la parte de los bracitos masajeadores que despertarán de una manera progresiva algunas zonas de tu cuerpo activando el deseo de placer; puedes usarlo para tus pezones, para el glande o para el clítoris.Con la parte del dildo puedes empezar haciendo círculos en la entrada de tu vagina para que aumente progresiva y lentamente tu deseo. Una vez hayas entrado en un estado de excitación puedes utilizar las estrías como guía para entender que la penetración es más disfrutable si no la hacemos de golpe y dejamos que nuestro cuerpo nos pida más y más.Te recomendamos siempre usar uno de nuestros lubricantes a base de agua como Desliz! para favorecer la penetración y aumentar el placer.No olvides limpiar antes y después de usarlo con agua tibia y un jabón neutro, o un jabón bactericida como Limpín. Sécalo bien antes de guardarlo y mantenlo alejado de otros juguetes, por ejemplo en una de nuestras bolsas de satén.  ",https://www.amantis.net/pasiflora-vibrador-punto-g-bracitos-masajeadores/,False,False,False,True,False,True,True,False
127,Romance Swan,vibración y succión en un solo juguete,"¿estas indecisa y no sabes si comprarte un vibrador o un succionador de clitoris? romance swan es un 2en1 que te ofrece las dos caras de la moneda, para que no tengas que renunciar a nada. por un lado, su parte redondeada con 12 funciones de vibracion diferentes, te permitira estimular toda la zona externa de tu vagina o bien penetrar en ella y hacerla retumbar de placer. el otro extremo del romance swan te ofrece 12 patrones de succion diferentes, para que puedas elegir el que mas te apetece en cada momento.¿eres una chica sola? prueba el juguete por uno u otro extremo alternativamente. ¿sois una pareja de chicas? escoged cada una la funcion que mas os apetezca y compartidlo al unisono. ¡despues podeis cambiar de turno!y tambien si sois chica-chico, disfruta del succionador de clitoris, mientras el lo hace con el cabezal vibratorio. ¡pocos juguetes te daran tanta versatilidad!se trata de un juguete fabricado en silicona medica, sumergible y recargable, ademas de tener un diseño ergonomico y ser muy facil de utilizar. ¿que mas se le puede pedir?","Vibrador y succionador 2 en 1Fabricado en silicona médica12 funciones de succión y 12 patrones de vibración diferentesDimensiones: 17,3 cm de longitud total / 3,6 cm de diámetroSalpicable IPX3Con batería recargable (cargador incluido)Color: púrpuraDebe utilizarse con lubricantes de base acuosaLimpiar correctamente antes y después de cada uso (con jabón neutro y/o bactericida tipo Límpín) ",https://www.amantis.net/romance-swan-vibracion-succion-un-solo-juguete/,False,False,False,True,False,True,True,False
128,SuctionMaster,poderoso desarrollador de pene automático,"el suctionmaster es un dispositivo revolucionario que combina la funcionalidad de un desarrollador de pene con el placer de una capsula de masturbacion. utilizando una tecnologia de succion avanzada, esta diseñado para hombres que desean mejorar su tamaño y disfrutar de una experiencia placentera y efectiva."," Destacadas:Bomba de Succión: Tecnología de vanguardia para el desarrollo efectivo del pene.Manga Masturbadora Automática: Con una manga suave para una experiencia agradable.Accesorios: Incluye 1 boquilla y una manga transparente.Modos de Vibración: 9 modos para una experiencia personalizable.Modos de Succión: 4 modos intermitentes y 1 modo continuo, para diversas intensidades.Recargable: Fácil de cargar, eliminando la necesidad de baterías externas.Medidas: Longitud de 31.50 cm y diámetro máximo de 8.8 cm. Manga masturbadora de 16.5 cm de longitud y 2.6 cm de diámetro interior.Material: Construido con ABS y TPE para durabilidad y seguridad.Beneficios del Desarrollador:Aumento de Tamaño: Ayuda en el desarrollo y aumento del tamaño del pene.Efectivo y Seguro: Combinación de succión y vibración para resultados efectivos y seguros.Experiencia de Usuario:El SuctionMaster es ideal para aquellos que buscan mejorar su virilidad y disfrutar de una experiencia de placer. Su diseño ergonómico y fácil manejo asegura una experiencia cómoda y efectiva.Instrucciones de Uso y Cuidado:Cargar completamente antes del primer uso.Usar con lubricante a base de agua para una experiencia óptima.Limpiar con agua y jabón neutro después de cada uso.Leer y seguir las instrucciones para un uso seguro y correcto.Advertencias de Seguridad:Liberación de Presión: En caso de sentir una presión elevada, simplemente gira la cápsula para separar la base. Esto liberará inmediatamente la presión, permitiendo un uso seguro y controlado.Suspende su uso si sientes cualquier molestia. Utilizalo progresivamente.Antes de probarlo con el pene, prueba con otra parte de tu cuerpo para sentir la presión y aprender a manejarlo.El producto se debe usar con el pene en erección.Suction Master es un producto con una gran potencia de succión, por favor asegurate de usarlo correctamente.Adquiere tu SuctionMaster:Descubre la combinación perfecta de desarrollo y placer con el SuctionMaster, un dispositivo innovador que redefine la experiencia masculina. ",https://www.amantis.net/suctionmaster-desarrollador-de-pene-automatico/,False,False,False,False,True,False,False,False
